title,score,comments,created_utc,selftext,url,author,upvote_ratio,flair,num_awards,subreddit,content,processed_content,sentiment,sentiment_label,created_date,week_day,month,hour,event_related,extreme_sentiment,strong_sentiment
Brazil's first lady insults Elon Musk at G20 social event,22684,1222,2024-11-17 04:05:32,,https://www.reuters.com/world/americas/brazils-first-lady-insults-elon-musk-g20-social-event-2024-11-17/,cmaia1503,0.91,,0,worldnews,Brazils first lady insults Elon Musk at G social event ,brazils first lady insults elon musk social event,-0.4215,negative,2024-11-17,6,11,4,False,moderate,weak
If Russia is so concerned about Ukraine’s defensive action then Russia should stop invading: UK statement at the UN Security Council ,22545,317,2024-12-23 21:24:37,,https://www.gov.uk/government/speeches/if-russia-is-so-concerned-about-ukraines-defensive-action-then-russia-should-stop-invading-uk-statement-at-the-un-security-council,eaglemaxie,0.97,Russia/Ukraine,0,worldnews,If Russia is so concerned about Ukraines defensive action then Russia should stop invading UK statement at the UN Security Council  ,russia concerned ukraines defensive action russia stop invading statement security council,0.0772,neutral,2024-12-23,0,12,21,False,moderate,weak
"Russia suffered 421,000 casualties in 2024, 'highest price' since start of invasion, Syrskyi says",22508,1000,2024-12-29 21:42:55,,https://kyivindependent.com/russia-suffered-421-000-casualties-in-2024-highest-price-since-start-of-invasion-syrskyi-says/,Yveliad,0.94,Russia/Ukraine,0,worldnews,Russia suffered  casualties in  highest price since start of invasion Syrskyi says ,russia suffered casualties highest price since start invasion syrskyi says,-0.4939,negative,2024-12-29,6,12,21,False,moderate,weak
"Russia amplified hurricane disinformation to drive Americans apart, researchers find",22499,699,2024-10-25 01:06:24,,https://www.aol.com/russia-amplified-hurricane-disinformation-drive-221838585.html,[deleted],0.93,Russia/Ukraine,0,worldnews,Russia amplified hurricane disinformation to drive Americans apart researchers find ,russia amplified hurricane disinformation drive americans apart researchers find,0.0,neutral,2024-10-25,4,10,1,False,moderate,weak
Terrorist convicted of murdering 4 in Paris synagogue is lecturer at Canadian university,22492,1732,2024-11-03 17:06:18,,https://www.ynetnews.com/article/rkj6jwh11je,alsonotjohnmalkovich,0.82,Convicted in absentia 2023,0,worldnews,Terrorist convicted of murdering  in Paris synagogue is lecturer at Canadian university ,terrorist convicted murdering paris synagogue lecturer canadian university,-0.875,negative,2024-11-03,6,11,17,False,extreme,strong
"Ukraine has produced its first 100 missiles, Zelensky says",22236,862,2024-11-09 20:35:57,,https://kyivindependent.com/ukraine-has-produced-its-first-100-missiles-zelensky-says/,Unlikely-Friend-5108,0.95,Russia/Ukraine,0,worldnews,Ukraine has produced its first  missiles Zelensky says ,ukraine produced first missiles zelensky says,0.0,neutral,2024-11-09,5,11,20,False,moderate,weak
Ukraine’s First All-Robot Assault Force Just Won Its First Battle,22093,1154,2024-12-22 00:41:53,,https://www.forbes.com/sites/davidaxe/2024/12/21/ukraines-first-all-robot-assault-force-just-won-its-first-battle/,eaglemaxie,0.94,Russia/Ukraine,0,worldnews,Ukraines First AllRobot Assault Force Just Won Its First Battle ,ukraines first allrobot assault force first battle,-0.7506,negative,2024-12-22,6,12,0,False,extreme,strong
Trump responds to Trudeau resignation by suggesting Canada merge with U.S. ,21917,6389,2025-01-06 19:09:12,,https://www.cbc.ca/news/politics/justin-trudeau-resigns-us-donald-trump-tariffs-1.7423756,AlwaysBlaze_,0.87,,0,worldnews,Trump responds to Trudeau resignation by suggesting Canada merge with US  ,trump responds trudeau resignation suggesting canada merge,-0.296,negative,2025-01-06,0,1,19,False,moderate,weak
Attempted coup d'etat reportedly taking place in Damascus ,21845,1712,2024-11-30 18:40:54,,https://www.jewishpress.com/news/middle-east/syria/attempted-coup-detat-taking-place-in-damascus/2024/11/30/,Inner-Championship40,0.94,Uncorroborated,0,worldnews,Attempted coup detat reportedly taking place in Damascus  ,attempted coup detat reportedly taking place damascus,0.0,neutral,2024-11-30,5,11,18,False,moderate,weak
Taliban minister declares women’s voices among women forbidden | Amu TV,21721,2289,2024-10-27 12:31:43,,https://amu.tv/133207/,Unhappy-Apple222,0.93,,0,worldnews,Taliban minister declares womens voices among women forbidden  Amu TV ,taliban minister declares womens voices among women forbidden amu,-0.4215,negative,2024-10-27,6,10,12,False,moderate,weak
‘What the f**k to do with them?’ Russian soldiers heard condemning North Korean recruits in intercepted audio,21712,1087,2024-10-26 05:21:26,,https://www.cnn.com/2024/10/25/europe/russian-soldiers-north-korean-recruits-intercepts-intl/index.html,DoremusJessup,0.96,Russia/Ukraine,0,worldnews,What the fk to do with them Russian soldiers heard condemning North Korean recruits in intercepted audio ,russian soldiers heard condemning north korean recruits intercepted audio,0.0,neutral,2024-10-26,5,10,5,False,moderate,weak
Ukrainian intelligence bludgeons Russian colonel to death with ‘hammer of justice’,21414,1409,2024-10-22 08:31:24,,https://tvpworld.com/83086476/ukrainian-intelligence-bludgeons-russian-colonel-to-death-with-hammer-of-justice,KrzyHooy,0.9,Russia/Ukraine,0,worldnews,Ukrainian intelligence bludgeons Russian colonel to death with hammer of justice ,ukrainian intelligence bludgeons russian colonel death hammer justice,0.3818,positive,2024-10-22,1,10,8,False,moderate,weak
White House official: 8 US telecom providers hacked by Chinese,21300,1153,2024-12-05 04:14:00,,https://www.cnn.com/2024/12/04/politics/us-telecom-providers-chinese-hack/index.html,SuperSpecialAwesome-,0.96,,0,worldnews,White House official  US telecom providers hacked by Chinese ,white house official telecom providers hacked chinese,-0.4019,negative,2024-12-05,3,12,4,False,moderate,weak
Russia bans fruit and veg from Kazakhstan after country refuses to join BRICS,21108,757,2024-10-18 11:00:06,,https://www.politico.eu/article/russia-bans-vegetables-from-kazakhstan-after-country-refuses-to-join-brics/,LES_GRINGO_YTB,0.96,Russia/Ukraine,0,worldnews,Russia bans fruit and veg from Kazakhstan after country refuses to join BRICS ,russia bans fruit veg kazakhstan country refuses join brics,0.296,positive,2024-10-18,4,10,11,False,moderate,weak
"Updated: Ukraine hits Russian naval base in Dagestan for first time, source says",21082,755,2024-11-06 14:49:24,,https://kyivindependent.com/ukraine-targeted-russian-naval-base-in-dagestan-drone-strike-source-says/,Snowfish52,0.96,Russia/Ukraine,0,worldnews,Updated Ukraine hits Russian naval base in Dagestan for first time source says ,updated ukraine hits russian naval base dagestan first time source says,0.0,neutral,2024-11-06,2,11,14,False,moderate,weak
"Russian Army division hit by desertions of ""whole regiment"": Report",21065,392,2024-11-20 09:39:38,,https://www.newsweek.com/russian-army-division-hit-desertions-whole-regiment-report-1988712,Visual-Explorer-111,0.95,Russia/Ukraine,0,worldnews,Russian Army division hit by desertions of whole regiment Report ,russian army division hit desertions whole regiment report,0.0,neutral,2024-11-20,2,11,9,False,moderate,weak
Trump strongly opposes US missile strikes deep into Russia,20988,3788,2024-12-12 16:55:40,,https://www.pravda.com.ua/eng/news/2024/12/12/7488837/,Silly-avocatoe,0.87,Russia/Ukraine,0,worldnews,Trump strongly opposes US missile strikes deep into Russia ,trump strongly opposes missile strikes deep russia,-0.1027,negative,2024-12-12,3,12,16,False,moderate,weak
More than 100 German legislators back motion to ban far-right AfD,20701,1818,2024-11-13 20:16:25,,https://www.yahoo.com/news/more-100-german-legislators-back-161229774.html?guccounter=1&amp;guce_referrer=aHR0cHM6Ly93d3cuZ29vZ2xlLmNvbS8&amp;guce_referrer_sig=AQAAAEPqRRD2LeIRgYWGSXjbydbMCufsXI25UPGUtsp0MuGx2FOQxP1EqKKHg42CWyEzfWJ9aOD1w5D7MzeJlqHcAbXgeVfwznx8AhrPUtQaFKwrfznbVQXrT2xK5djQ7mb4PaQc8ZqiZZe7mIGI5Ay35INhYgQWjwm5MnGJQE_FzJNR,Leather-Paramedic-10,0.9,,0,worldnews,More than  German legislators back motion to ban farright AfD ,german legislators back motion ban farright afd,-0.5574,negative,2024-11-13,2,11,20,False,extreme,strong
"Russian attack on cancer treatment center in Kherson 'heinous act of cruelty against civilians,' Zelensky says",20648,330,2024-12-22 14:22:19,,https://kyivindependent.com/russian-attack-on-cancer-treatment-center-in-kherson-heinous-act-of-cruelty-against-civilians-zelensky-says/,AdSpecialist6598,0.96,Russia/Ukraine,0,worldnews,Russian attack on cancer treatment center in Kherson heinous act of cruelty against civilians Zelensky says ,russian attack cancer treatment center kherson heinous act cruelty civilians zelensky says,-0.9081,negative,2024-12-22,6,12,14,False,extreme,strong
Zelensky Says War in Ukraine Will End Sooner with Trump in Office,20583,2749,2024-11-16 09:25:45,,https://www.kyivpost.com/post/42318,strimholov,0.87,Russia/Ukraine,0,worldnews,Zelensky Says War in Ukraine Will End Sooner with Trump in Office ,zelensky says war ukraine end sooner trump office,-0.5994,negative,2024-11-16,5,11,9,True,extreme,strong
Ukraine Carries Out First ATACMS Strike in Russia: RBC-Ukraine,20533,1979,2024-11-19 09:26:04,,https://www.bloomberg.com/news/articles/2024-11-19/ukraine-carries-out-first-atacms-strike-in-russia-rbc-ukraine,bloomberg,0.95,Behind Soft Paywall,0,worldnews,Ukraine Carries Out First ATACMS Strike in Russia RBCUkraine ,ukraine carries first atacms strike russia rbcukraine,-0.128,negative,2024-11-19,1,11,9,False,moderate,weak
Ukraine targets North Korean troops with psychological warfare,20433,765,2024-12-12 19:56:50,,https://www.newsweek.com/ukraine-news-targets-north-korean-troops-psychological-warfare-russia-better-life-1999578,No-Information6622,0.95,Russia/Ukraine,0,worldnews,Ukraine targets North Korean troops with psychological warfare ,ukraine targets north korean troops psychological warfare,-0.296,negative,2024-12-12,3,12,19,True,moderate,weak
Ukraine flag appears on big screen during Putin visit to Kazakhstan,20393,159,2024-11-28 10:53:34,,https://www.reuters.com/world/ukraine-flag-appears-big-screen-during-putin-visit-kazakhstan-2024-11-28/,rustoren,0.96,Russia/Ukraine,0,worldnews,Ukraine flag appears on big screen during Putin visit to Kazakhstan ,ukraine flag appears big screen putin visit kazakhstan,0.0,neutral,2024-11-28,3,11,10,False,moderate,weak
‘There is no money’: Cuba fears total collapse amid grid failure and financial crisis,20364,2474,2024-10-26 13:59:11,,https://www.theguardian.com/world/2024/oct/26/cuba-power-grid-failure-financial-crisis,Advanced_Drink_8536,0.95,,0,worldnews,There is no money Cuba fears total collapse amid grid failure and financial crisis ,money cuba fears total collapse amid grid failure financial crisis,-0.9246,negative,2024-10-26,5,10,13,False,extreme,strong
Reports of explosions in Tehran,20358,3042,2024-10-25 23:08:27,,https://www.jpost.com/breaking-news/article-826117,seenabeenacat,0.92,Israel confirms it struck Iran*,0,worldnews,Reports of explosions in Tehran ,reports explosions tehran,0.0,neutral,2024-10-25,4,10,23,False,moderate,weak
Ukraine unveils laser weapon capable of downing aircraft,20293,1165,2024-12-16 16:36:17,,https://newsukraine.rbc.ua/news/ukraine-unveils-laser-weapon-capable-of-downing-1734365592.html,Silly-avocatoe,0.94,Russia/Ukraine,0,worldnews,Ukraine unveils laser weapon capable of downing aircraft ,ukraine unveils laser weapon capable downing aircraft,0.1027,positive,2024-12-16,0,12,16,False,moderate,weak
"It Took Nearly Two Years, But Large Numbers Of German-Made Leopard 1 Tanks Are Finally Arriving In Ukraine",20039,601,2024-12-26 20:55:00,,https://www.forbes.com/sites/davidaxe/2024/12/26/it-took-nearly-two-years-but-large-numbers-of-german-made-leopard-1-tanks-are-finally-arriving-in-ukraine/,eaglemaxie,0.96,Russia/Ukraine,0,worldnews,It Took Nearly Two Years But Large Numbers Of GermanMade Leopard  Tanks Are Finally Arriving In Ukraine ,took nearly two years large numbers germanmade leopard tanks finally arriving ukraine,0.0,neutral,2024-12-26,3,12,20,False,moderate,weak
"US to send $15 billion to Ukraine using frozen Russian assets, PM says",20027,476,2024-12-30 11:56:10,,https://kyivindependent.com/us-to-send-15-billion-to-ukraine-using-frozen-russian-assets-pm-says/,javelin3000,0.96,Russia/Ukraine,0,worldnews,US to send  billion to Ukraine using frozen Russian assets PM says ,send billion ukraine using frozen russian assets says,0.1779,positive,2024-12-30,0,12,11,False,moderate,weak
"After Trump win, French President Macron asks if EU is 'ready to defend' European interests",19797,1630,2024-11-08 03:46:56,,https://www.foxnews.com/world/after-trump-win-french-president-macron-asks-eu-ready-defend-european-interests,Deedogg11,0.95,,0,worldnews,After Trump win French President Macron asks if EU is ready to defend European interests ,trump win french president macron asks ready defend european interests,0.8074,positive,2024-11-08,4,11,3,False,extreme,strong
White House pressing Ukraine to draft 18-year-olds so they have enough troops to battle Russia,19728,4613,2024-11-27 18:30:04,,https://apnews.com/article/ukraine-war-biden-draft-08e3bad195585b7c3d9662819cc5618f?utm_source=copy&amp;utm_medium=share,thegoodsamuraii,0.9,Russia/Ukraine,0,worldnews,White House pressing Ukraine to draft yearolds so they have enough troops to battle Russia ,white house pressing ukraine draft yearolds enough troops battle russia,-0.3818,negative,2024-11-27,2,11,18,False,moderate,weak
"North Korea has sent 10,000 soldiers to Russia, Western source says",19493,1612,2024-10-16 01:19:13,,https://kyivindependent.com/north-korea-has-sent-10-000-soldiers-to-russia-western-source-says/,BothZookeepergame612,0.95,Russia/Ukraine,0,worldnews,North Korea has sent  soldiers to Russia Western source says ,north korea sent soldiers russia western source says,0.0,neutral,2024-10-16,2,10,1,False,moderate,weak
Mass grave containing thousands of bodies discovered in Aleppo,19472,629,2024-12-31 21:05:22,,https://www.middleeastmonitor.com/20241231-mass-grave-containing-thousands-of-bodies-discovered-in-aleppo/amp/,FinnBalur1,0.96,,0,worldnews,Mass grave containing thousands of bodies discovered in Aleppo ,mass grave containing thousands bodies discovered aleppo,-0.3818,negative,2024-12-31,1,12,21,False,moderate,weak
Death sentence upheld for property tycoon in Vietnam — unless she pays $9 billion before execution,19379,1451,2024-12-04 00:43:49,,https://www.cbsnews.com/news/vietnam-death-sentence-tycoon-truong-my-lan-upheld-unless-pays-9-billion/,Just-Sale-7015,0.97,,0,worldnews,Death sentence upheld for property tycoon in Vietnam  unless she pays  billion before execution ,death sentence upheld property tycoon vietnam unless pays billion execution,-0.5574,negative,2024-12-04,2,12,0,False,extreme,strong
Ukraine war: US gives $20bn to Kyiv funded by seized Russian assets,19338,470,2024-12-10 21:26:42,,https://www.bbc.com/news/articles/c047zrzr2xro,TheFrederalGovt,0.95,Russia/Ukraine,0,worldnews,Ukraine war US gives bn to Kyiv funded by seized Russian assets ,ukraine war gives kyiv funded seized russian assets,-0.4939,negative,2024-12-10,1,12,21,True,moderate,weak
Kim Jong Un might have sent weak and unprepared soldiers to Russia – Wall Street Journal,19282,1264,2024-10-28 10:48:26,,https://www.pravda.com.ua/eng/news/2024/10/28/7481699/,Silly-avocatoe,0.93,Russia/Ukraine,0,worldnews,Kim Jong Un might have sent weak and unprepared soldiers to Russia  Wall Street Journal ,kim jong might sent weak unprepared soldiers russia wall street journal,-0.4404,negative,2024-10-28,0,10,10,False,moderate,weak
"""I betrayed my Party"": Ukrainian forces publish diary of dead North Korean soldier",19217,1123,2024-12-29 04:38:54,,https://www.pravda.com.ua/eng/news/2024/12/28/7491107/,eaglemaxie,0.94,Russia/Ukraine,0,worldnews,I betrayed my Party Ukrainian forces publish diary of dead North Korean soldier ,betrayed party ukrainian forces publish diary dead north korean soldier,-0.765,negative,2024-12-29,6,12,4,False,extreme,strong
Trump open to using 'economic force' to acquire Canada as a state,19265,6430,2025-01-07 19:30:55,,https://www.ctvnews.ca/politics/trump-open-to-using-economic-force-to-acquire-canada-as-a-state-1.7167098,TokenBearer,0.87,,0,worldnews,Trump open to using economic force to acquire Canada as a state ,trump open using economic force acquire canada state,0.0,neutral,2025-01-07,1,1,19,False,moderate,weak
Ukraine strikes Russian air base with ATACMS missiles crippling aircraft repair capabilities,19108,441,2024-12-16 19:32:33,,https://euromaidanpress.com/2024/12/16/frontline-report-ukraine-strikes-russian-air-base-with-atacms-missiles-crippling-aircraft-repair-capabilities/,strimholov,0.96,Russia/Ukraine,0,worldnews,Ukraine strikes Russian air base with ATACMS missiles crippling aircraft repair capabilities ,ukraine strikes russian air base atacms missiles crippling aircraft repair capabilities,-0.3612,negative,2024-12-16,0,12,19,False,moderate,weak
Trump threatens tariffs If EU doesn’t buy more US oil and gas,18920,2254,2024-12-20 08:09:24,,https://www.moneycontrol.com/news/world/trump-threatens-tariffs-if-eu-doesn-t-buy-more-us-oil-and-gas-12894641.html,xperia3310,0.91,,0,worldnews,Trump threatens tariffs If EU doesnt buy more US oil and gas ,trump threatens tariffs doesnt buy oil gas,-0.3818,negative,2024-12-20,4,12,8,False,moderate,weak
WSJ: Russia orchestrated Chinese ship's Baltic cable sabotage ,18746,656,2024-12-16 03:41:31,,https://euromaidanpress.com/2024/12/15/wsj-russia-orchestrated-chinese-ships-baltic-cable-sabotage/,Silly-avocatoe,0.95,Russia/Ukraine,0,worldnews,WSJ Russia orchestrated Chinese ships Baltic cable sabotage  ,wsj russia orchestrated chinese ships baltic cable sabotage,-0.5267,negative,2024-12-16,0,12,3,False,extreme,strong
Australia plans social media ban for under-16s,18678,1210,2024-11-07 03:57:57,,https://www.bbc.com/news/articles/c4gzd62g1r3o,javelin3000,0.96,,0,worldnews,Australia plans social media ban for unders ,australia plans social media ban unders,-0.5574,negative,2024-11-07,3,11,3,False,extreme,strong
"Russian commanders refusing ""suicidal"" orders to cross Dnieper River—Report",18672,453,2024-12-23 19:37:17,,https://www.newsweek.com/russian-commanders-refusing-suicidal-orders-cross-dnieper-river-report-2005256,NaiE007,0.96,Russia/Ukraine,0,worldnews,Russian commanders refusing suicidal orders to cross Dnieper RiverReport ,russian commanders refusing suicidal orders cross dnieper riverreport,-0.802,negative,2024-12-23,0,12,19,False,extreme,strong
"""We captured a lot of Russian weapons from HAMAS, may send them to Ukraine,"" says Israeli politician - Euromaidan Press",18510,463,2024-11-05 04:32:32,,https://euromaidanpress.com/2024/11/04/we-captured-a-lot-of-russian-weapons-from-hamas-may-send-them-to-ukraine-says-israeli-politician/?swcfpc=1&amp;fbclid=IwY2xjawGWfnBleHRuA2FlbQIxMQABHeHbZUqefqCF9XoSm1P1XopmI2fTQazV_P5aH9hlhOoh8YkQaXAjcu8Oyw_aem_KF81mXI1rf5v5hFQcwuXaA,Silly-avocatoe,0.91,Russia/Ukraine,0,worldnews,We captured a lot of Russian weapons from HAMAS may send them to Ukraine says Israeli politician  Euromaidan Press ,captured lot russian weapons hamas may send ukraine says israeli politician euromaidan press,-0.4404,negative,2024-11-05,1,11,4,False,moderate,weak
"Ukraine war briefing: western allies’ response to North Korean deployment is ‘zero’, Zelenskyy says ",18248,1680,2024-11-01 10:53:05,,https://www.theguardian.com/world/2024/nov/01/ukraine-war-briefing-western-allies-response-to-north-korean-deployment-is-zero-zelenskyy-says,xc2215x,0.94,Russia/Ukraine,0,worldnews,Ukraine war briefing western allies response to North Korean deployment is zero Zelenskyy says  ,ukraine war briefing western allies response north korean deployment zero zelenskyy says,-0.5994,negative,2024-11-01,4,11,10,True,extreme,strong
Russians Captured 9 Ukrainian Drone Operators And Then Murdered Them,18218,1972,2024-10-16 12:15:45,,https://www.forbes.com/sites/davidaxe/2024/10/13/russian-troops-captured-nine-ukrainian-drone-operators-stripped-them-and-then-murdered-them/,superanth,0.92,,0,worldnews,Russians Captured  Ukrainian Drone Operators And Then Murdered Them ,russians captured ukrainian drone operators murdered,-0.6597,negative,2024-10-16,2,10,12,False,extreme,strong
China Wiretaps Americans in ‘Worst Hack in Our Nation’s History’,18207,1074,2024-11-22 22:57:52,,https://gizmodo.com/china-wiretaps-americans-in-worst-hack-in-our-nations-history-2000528424,Fur-Frisbee,0.95,,0,worldnews,China Wiretaps Americans in Worst Hack in Our Nations History ,china wiretaps americans worst hack nations history,-0.6249,negative,2024-11-22,4,11,22,False,extreme,strong
Far-right candidate takes shock lead in Romania presidential election,18178,2104,2024-11-25 02:41:03,,https://www.bbc.com/news/articles/c9dlw5pq967o,Deedogg11,0.92,,0,worldnews,Farright candidate takes shock lead in Romania presidential election ,farright candidate takes shock lead romania presidential election,-0.3818,negative,2024-11-25,0,11,2,True,moderate,weak
Russian general accused of running torture camps dies in Ukraine,18156,232,2024-11-09 11:32:59,,https://kyivindependent.com/russian-general-accused-of-running-torture-camps-dies-in-ukraine/,blllrrrrr,0.96,Russia/Ukraine,0,worldnews,Russian general accused of running torture camps dies in Ukraine ,russian general accused running torture camps dies ukraine,-0.7269,negative,2024-11-09,5,11,11,False,extreme,strong
"More than 600,000 rounds of Swiss sniper ammunition reach Ukraine",18142,571,2024-11-22 11:50:44,,https://www.swissinfo.ch/eng/swiss-politics/645000-rounds-of-swiss-sniper-ammunition-reach-ukraine/88276794?utm_source=multiple&amp;utm_medium=website&amp;utm_campaign=news_en&amp;utm_content=o&amp;utm_term=wpblock_highlighted-compact-news-carousel,BezugssystemCH1903,0.96,Russia/Ukraine,0,worldnews,More than  rounds of Swiss sniper ammunition reach Ukraine ,rounds swiss sniper ammunition reach ukraine,0.0258,neutral,2024-11-22,4,11,11,False,moderate,weak
(South Korea) Army special warfare commander says he defied order to drag out lawmakers,18053,685,2024-12-06 05:20:05,,https://en.yna.co.kr/view/AEN20241206005700315?section=national/politics,SoViDArtworks,0.98,,0,worldnews,South Korea Army special warfare commander says he defied order to drag out lawmakers ,south korea army special warfare commander says defied order drag lawmakers,-0.1027,negative,2024-12-06,4,12,5,True,moderate,weak
Russia threatens South Korea amid arrival of DPRK military – Russian media,18069,1058,2024-10-23 15:56:33,,https://www.pravda.com.ua/eng/news/2024/10/23/7481035/,Silly-avocatoe,0.95,Russia/Ukraine,0,worldnews,Russia threatens South Korea amid arrival of DPRK military  Russian media ,russia threatens south korea amid arrival dprk military russian media,-0.3818,negative,2024-10-23,2,10,15,False,moderate,weak
Israeli Strikes Knocked Out All Of Iran’s S-300 Air Defense Systems: Officials,18039,1286,2024-10-28 21:01:32,,https://www.twz.com/news-features/israeli-strikes-knocked-out-all-of-irans-s-300-air-defense-systems-officials,SyntheticSweetener,0.91,Israel/Palestine,0,worldnews,Israeli Strikes Knocked Out All Of Irans S Air Defense Systems Officials ,israeli strikes knocked irans air defense systems officials,-0.25,negative,2024-10-28,0,10,21,False,moderate,weak
UK army chief: We’re ready to fight Putin in Eastern Europe,18048,1511,2024-11-21 14:56:07,,https://www.politico.eu/article/uk-army-chief-rob-magowan-ready-fight-russia-vladimir-putin-eastern-europe/,Designer-Citron-8880,0.95,Russia/Ukraine,0,worldnews,UK army chief Were ready to fight Putin in Eastern Europe ,army chief ready fight putin eastern europe,-0.0258,neutral,2024-11-21,3,11,14,False,moderate,weak
"Iran's Khamenei seriously ill, son likely to be successor as supreme leader - NYT",17858,1020,2024-10-27 00:34:36,,https://www.jpost.com/middle-east/iran-news/article-826211,Logical_Welder3467,0.94,,0,worldnews,Irans Khamenei seriously ill son likely to be successor as supreme leader  NYT ,irans khamenei seriously ill son likely successor supreme leader nyt,0.25,positive,2024-10-27,6,10,0,False,moderate,weak
Zelensky Says Hopes Trump 'Victory' Will Bring 'Just Peace In Ukraine Closer' ,17840,2886,2024-11-06 09:23:56,,https://www.barrons.com/news/zelensky-says-hopes-trump-victory-will-bring-just-peace-in-ukraine-closer-1f686564,BobbyLucero,0.94,Russia/Ukraine,0,worldnews,Zelensky Says Hopes Trump Victory Will Bring Just Peace In Ukraine Closer  ,zelensky says hopes trump victory bring peace ukraine closer,0.743,positive,2024-11-06,2,11,9,True,extreme,strong
El Salvador closes 2024 with a record low number of homicides,17815,1240,2025-01-02 17:38:56,,https://abcnews.go.com/International/wireStory/el-salvador-closes-2024-record-low-number-homicides-117257063,No-Information6622,0.95,,0,worldnews,El Salvador closes  with a record low number of homicides ,salvador closes record low number homicides,-0.2023,negative,2025-01-02,3,1,17,False,moderate,weak
US B-2 bombers strike Iran-backed Houthis in Yemen | CNN Politics,17767,2138,2024-10-17 02:05:31,,https://www.cnn.com/2024/10/16/politics/us-strikes-iran-backed-houthis-yemen?cid=ios_app,Advanced_Drink_8536,0.93,,0,worldnews,US B bombers strike Iranbacked Houthis in Yemen  CNN Politics ,bombers strike iranbacked houthis yemen cnn politics,-0.128,negative,2024-10-17,3,10,2,False,moderate,weak
