title,score,comments,created_utc,selftext,url,author,upvote_ratio,flair,num_awards,subreddit,content,processed_content,sentiment,sentiment_label,created_date,week_day,month,hour,event_related,extreme_sentiment,strong_sentiment
Elon Musk joined Trump call with Ukraine’s Zelensky after US election,30440,5068,2024-11-08 19:51:59,,https://www.cnn.com/2024/11/08/europe/ukraine-trump-elon-musk-zelensky-intl-latam?cid=ios_app,[deleted],0.88,Russia/Ukraine,0,worldnews,Elon Musk joined Trump call with Ukraines Zelensky after US election ,elon musk joined trump call ukraines zelensky election,0.0,neutral,2024-11-08,4,11,19,True,moderate,weak
Ukrainian F-16 pilot sets historical record by shooting down six cruise missiles in one sortie,30153,898,2025-01-07 12:04:05,,https://en.interfax.com.ua/news/general/1039108.html,HydrolicKrane,0.94,Russia/Ukraine,0,worldnews,Ukrainian F pilot sets historical record by shooting down six cruise missiles in one sortie ,ukrainian pilot sets historical record shooting six cruise missiles one sortie,0.0,neutral,2025-01-07,1,1,12,False,moderate,weak
BBC News - US Treasury says it was hacked by China,29880,1822,2024-12-30 22:14:19,,https://www.bbc.com/news/articles/c3weye2j0e7o,-DEUS-FAX-MACHINA-,0.95,,0,worldnews,BBC News  US Treasury says it was hacked by China ,bbc news treasury says hacked china,-0.2263,negative,2024-12-30,0,12,22,False,moderate,weak
Russian military plane worth $4.5m explodes at airfield near Moscow: Kyiv,29880,839,2024-12-20 13:13:16,,https://www.newsweek.com/russian-military-plane-explodes-airfield-moscow-kyiv-2004075,indig0sixalpha,0.94,Russia/Ukraine,0,worldnews,Russian military plane worth m explodes at airfield near Moscow Kyiv ,russian military plane worth explodes airfield near moscow kyiv,0.2263,positive,2024-12-20,4,12,13,False,moderate,weak
"Russia says Ukraine attacked it using U.S. long-range missiles, signals it's ready for nuclear response",29833,5183,2024-11-19 16:43:06,,https://www.cnbc.com/2024/11/19/russia-says-ukraine-attacked-it-using-us-made-missiles.html,Chicamaw,0.9,Russia/Ukraine,0,worldnews,Russia says Ukraine attacked it using US longrange missiles signals its ready for nuclear response ,russia says ukraine attacked using longrange missiles signals ready nuclear response,-0.128,negative,2024-11-19,1,11,16,False,moderate,weak
"Russia Tests Cutting Off Access to Global Web, and VPNs Can't Get Around It",29774,2168,2024-12-11 10:59:00,,https://www.pcmag.com/news/russia-tests-cutting-off-access-to-global-web-and-vpns-cant-get-around,Street_Anon,0.95,Russia/Ukraine,0,worldnews,Russia Tests Cutting Off Access to Global Web and VPNs Cant Get Around It ,russia tests cutting access global web vpns cant get around,-0.128,negative,2024-12-11,2,12,10,False,moderate,weak
Berlin police advise LGBTQ and Jews to avoid Arab-majority areas,29754,4185,2024-11-19 04:44:21,,https://www.ynetnews.com/article/h1atr7kgke,Red_Franklin,0.81,,0,worldnews,Berlin police advise LGBTQ and Jews to avoid Arabmajority areas ,berlin police advise lgbtq jews avoid arabmajority areas,-0.296,negative,2024-11-19,1,11,4,False,moderate,weak
Berlin accuses Elon Musk of seeking to influence Germany's election,29550,1253,2024-12-30 13:42:11,,https://www.axios.com/2024/12/30/germany-election-elon-musk-afd-endorsement,Unusual-State1827,0.94,,0,worldnews,Berlin accuses Elon Musk of seeking to influence Germanys election ,berlin accuses elon musk seeking influence germanys election,-0.34,negative,2024-12-30,0,12,13,True,moderate,weak
Elon Musk pens German newspaper opinion piece supporting far-right AfD party. Billionaire Trump adviser said his ‘significant investments’ in the country justified his wading into German politics,29384,2031,2024-12-28 16:55:22,,https://www.theguardian.com/world/2024/dec/28/elon-musk-germany-afd-party,indig0sixalpha,0.92,,0,worldnews,Elon Musk pens German newspaper opinion piece supporting farright AfD party Billionaire Trump adviser said his significant investments in the country justified his wading into German politics ,elon musk pens german newspaper opinion piece supporting farright afd party billionaire trump adviser said significant investments country justified wading german politics,0.8442,positive,2024-12-28,5,12,16,False,extreme,strong
Putin slashes soldiers' payouts as Russia's losses in Ukraine skyrocket,28977,1469,2024-11-14 15:50:00,,https://www.newsweek.com/russia-ukraine-war-troops-losses-1985722,NaiE007,0.94,Russia/Ukraine,0,worldnews,Putin slashes soldiers payouts as Russias losses in Ukraine skyrocket ,putin slashes soldiers payouts russias losses ukraine skyrocket,-0.5423,negative,2024-11-14,3,11,15,False,extreme,strong
"Biden approves antipersonnel mines for Ukraine, undoing his own policy ",28802,1670,2024-11-20 00:43:54,,https://www.washingtonpost.com/national-security/2024/11/19/biden-landmines-ukraine-russia/?utm_campaign=wp_main&amp;utm_medium=social&amp;utm_source=reddit.com,washingtonpost,0.93,Behind Soft Paywall,0,worldnews,Biden approves antipersonnel mines for Ukraine undoing his own policy  ,biden approves antipersonnel mines ukraine undoing policy,0.4019,positive,2024-11-20,2,11,0,False,moderate,weak
Russians ‘burning faces’ of dead North Koreans to keep them secret: Zelenskyy,28741,1268,2024-12-17 17:54:06,,https://www.rfa.org/english/korea/2024/12/17/north-korean-soldier-video-russia-12172024/,giuliomagnifico,0.91,Russia/Ukraine,0,worldnews,Russians burning faces of dead North Koreans to keep them secret Zelenskyy ,russians burning faces dead north koreans keep secret zelenskyy,-0.6486,negative,2024-12-17,1,12,17,False,extreme,strong
Egypt declared malaria-free after 100-year effort,28482,330,2024-10-20 20:39:37,,https://www.bbc.com/news/articles/cm2yl8pjgn2o,giuliomagnifico,0.97,,0,worldnews,Egypt declared malariafree after year effort ,egypt declared malariafree year effort,0.0,neutral,2024-10-20,6,10,20,False,moderate,weak
‘Shoot All the Locals’ – Russian Officer Orders Civilian Executions in Luhansk Region,28220,943,2025-01-01 16:13:43,,https://www.kyivpost.com/post/44762,Yveliad,0.94,Russia/Ukraine,0,worldnews,Shoot All the Locals  Russian Officer Orders Civilian Executions in Luhansk Region ,shoot locals russian officer orders civilian executions luhansk region,-0.34,negative,2025-01-01,2,1,16,False,moderate,weak
Ballet star Vladimir Shklyarov who criticised Putin’s Ukraine invasion dies in fall from building in St. Petersburg,28215,1177,2024-11-18 13:37:14,,https://www.lbc.co.uk/news/vladimir-shklyarov-death-st-petersburg-ballet-star-fall/,blllrrrrr,0.95,Russia/Ukraine,0,worldnews,Ballet star Vladimir Shklyarov who criticised Putins Ukraine invasion dies in fall from building in St Petersburg ,ballet star vladimir shklyarov criticised putins ukraine invasion dies fall building petersburg,-0.4215,negative,2024-11-18,0,11,13,False,moderate,weak
Putin's generals are turning on each other,28174,788,2024-11-01 17:14:51,,https://www.newsweek.com/russia-putin-general-arrest-1977233,TylerFortier_Photo,0.86,,0,worldnews,Putins generals are turning on each other ,putins generals turning,0.0,neutral,2024-11-01,4,11,17,False,moderate,weak
Lukashenko warns of war if Russia attempts to annex Belarus,27452,1751,2024-10-25 10:26:54,,https://newsukraine.rbc.ua/news/lukashenko-warns-of-war-if-russia-attempts-1729846029.html,BringbackDreamBars,0.94,,0,worldnews,Lukashenko warns of war if Russia attempts to annex Belarus ,lukashenko warns war russia attempts annex belarus,-0.6486,negative,2024-10-25,4,10,10,True,extreme,strong
French government toppled in historic no-confidence vote,27422,2003,2024-12-04 19:31:46,,https://www.lemonde.fr/en/france/article/2024/12/04/french-government-toppled-in-historic-no-confidence-vote_6735189_7.html,Lanathell,0.96,,0,worldnews,French government toppled in historic noconfidence vote ,french government toppled historic noconfidence vote,0.0,neutral,2024-12-04,2,12,19,False,moderate,weak
Kyiv reveals total Ukraine casualties in Putin’s war for first time,27221,2459,2024-12-08 14:41:55,,https://www.politico.eu/article/ukraine-volodymyr-zelenskyy-announces-its-total-military-casualties-first-time/,eaglemaxie,0.92,Russia/Ukraine,0,worldnews,Kyiv reveals total Ukraine casualties in Putins war for first time ,kyiv reveals total ukraine casualties putins war first time,-0.5994,negative,2024-12-08,6,12,14,True,extreme,strong
Zelenskiy blasts allies for 'zero' response to North Korean deployment,27005,1852,2024-10-31 19:32:55,,https://www.reuters.com/world/europe/ukraines-zelenskiy-blasts-allies-zero-response-nkorean-deployment-2024-10-31/,VictorEmmanuelIV,0.92,North Korea,0,worldnews,Zelenskiy blasts allies for zero response to North Korean deployment ,zelenskiy blasts allies zero response north korean deployment,0.0,neutral,2024-10-31,3,10,19,False,moderate,weak
"Javier Milei ends budget deficit in Argentina, first time in 123 years",26938,3821,2024-12-13 09:45:16,,https://gazettengr.com/javier-milei-ends-budget-deficit-in-argentina-first-time-in-123-years/,BlitzOrion,0.81,,0,worldnews,Javier Milei ends budget deficit in Argentina first time in  years ,javier milei ends budget deficit argentina first time years,-0.4019,negative,2024-12-13,4,12,9,False,moderate,weak
"Russia’s use of unidentified gas surges on the front line, Ukraine lacks detectors",26787,1258,2024-11-04 00:47:41,,https://kyivindependent.com/russias-use-of-unidentified-gas-surges-on-the-front-line-ukraine-lacks-detectors/,BothZookeepergame612,0.95,Russia/Ukraine,0,worldnews,Russias use of unidentified gas surges on the front line Ukraine lacks detectors ,russias use unidentified gas surges front line ukraine lacks detectors,0.0,neutral,2024-11-04,0,11,0,False,moderate,weak
Russia Arrests Top General as Military Purge Ramps Up,26682,808,2024-11-05 10:46:40,,https://www.newsweek.com/russia-arrests-general-military-purge-putin-war-mirza-mirzaev-1979651,blllrrrrr,0.95,Russia/Ukraine,0,worldnews,Russia Arrests Top General as Military Purge Ramps Up ,russia arrests top general military purge ramps,-0.2732,negative,2024-11-05,1,11,10,False,moderate,weak
Iranian student strips in protest against assault by hijab enforcers.,26576,1280,2024-11-02 17:09:57,,https://www.iranintl.com/en/202411025012,DibaWho,0.94,,0,worldnews,Iranian student strips in protest against assault by hijab enforcers ,iranian student strips protest assault hijab enforcers,-0.7003,negative,2024-11-02,5,11,17,False,extreme,strong
"‘If Ukraine fails, war will come to the streets of European cities,’ former foreign minister says",26047,1386,2024-12-13 19:12:51,,https://www.cnbc.com/amp/2024/12/13/if-ukraine-fails-against-russia-war-will-come-to-europe-dmytro-kuleba.html,EndocardialCushion,0.9,Russia/Ukraine,0,worldnews,If Ukraine fails war will come to the streets of European cities former foreign minister says ,ukraine fails war come streets european cities former foreign minister says,-0.7717,negative,2024-12-13,4,12,19,True,extreme,strong
Trudeau says 'not a snowball's chance in hell' Canada joins U.S. | CBC News,26148,2866,2025-01-07 20:23:31,,https://www.cbc.ca/news/world/trump-canada-tariffs-51st-state-news-conference-1.7424897,Miserable-Lizard,0.93,,0,worldnews,Trudeau says not a snowballs chance in hell Canada joins US  CBC News ,trudeau says snowballs chance hell canada joins cbc news,-0.5574,negative,2025-01-07,1,1,20,False,extreme,strong
Jordan Peterson says he is considering legal action after Trudeau accused him of taking Russian money,25919,2713,2024-10-19 10:14:36,,https://nationalpost.com/news/canada/jordan-peterson-legal-action-trudeau-accused-russian-money,Street_Anon,0.89,Russia/Ukraine,0,worldnews,Jordan Peterson says he is considering legal action after Trudeau accused him of taking Russian money ,jordan peterson says considering legal action trudeau accused taking russian money,-0.1779,negative,2024-10-19,5,10,10,False,moderate,weak
"Russia terrorizes Ukraine with mass missile, drone attack on Christmas morning",25899,1612,2024-12-25 05:56:18,,https://kyivindependent.com/russia-terrorizes-ukraine-with-mass-missile-drone-attack-on-christmas-morning/,Snowfish52,0.93,Russia/Ukraine,0,worldnews,Russia terrorizes Ukraine with mass missile drone attack on Christmas morning ,russia terrorizes ukraine mass missile drone attack christmas morning,-0.802,negative,2024-12-25,2,12,5,False,extreme,strong
Italian president tells Musk to quit meddling in Italy's politics,25767,900,2024-11-13 22:32:06,,https://www.reuters.com/world/italian-president-tells-musk-quit-meddling-italys-domestic-politics-2024-11-13/,cmaia1503,0.93,,0,worldnews,Italian president tells Musk to quit meddling in Italys politics ,italian president tells musk quit meddling italys politics,0.0,neutral,2024-11-13,2,11,22,False,moderate,weak
Russian Su-34 supersonic fighter-bomber shot down by F-16: reports,25758,1626,2024-10-12 14:37:42,,https://www.newsweek.com/russia-ukraine-sukhoi-f-16-1968041,HydrolicKrane,0.94,Russia/Ukraine,0,worldnews,Russian Su supersonic fighterbomber shot down by F reports ,russian supersonic fighterbomber shot reports,0.0,neutral,2024-10-12,5,10,14,False,moderate,weak
"Russia has launched 'staggeringly reckless campaign of sabotage' in Europe, says MI6 chief",25422,1286,2024-11-30 07:55:22,,https://www.telegraph.co.uk/news/2024/11/29/putin-russia-reckless-campaign-sabotage-europe-mi6-chief/,TheTelegraph,0.95,Russia/Ukraine,0,worldnews,Russia has launched staggeringly reckless campaign of sabotage in Europe says MI chief ,russia launched staggeringly reckless campaign sabotage europe says chief,-0.6808,negative,2024-11-30,5,11,7,False,extreme,strong
Elon Musk backs German far-right party that supports Putin – Reuters,25231,1440,2024-12-20 16:16:03,,https://www.pravda.com.ua/eng/news/2024/12/20/7490025/,Yveliad,0.93,Russia/Ukraine,0,worldnews,Elon Musk backs German farright party that supports Putin  Reuters ,elon musk backs german farright party supports putin reuters,0.6124,positive,2024-12-20,4,12,16,False,extreme,strong
Ukraine's military says Russia launched intercontinental ballistic missile in the morning,25187,3520,2024-11-21 08:01:30,,https://www.deccanherald.com/world/ukraines-military-says-russia-launched-intercontinental-ballistic-missile-in-the-morning-3285594,diegolo22,0.94,Russia/Ukraine,0,worldnews,Ukraines military says Russia launched intercontinental ballistic missile in the morning ,ukraines military says russia launched intercontinental ballistic missile morning,0.128,positive,2024-11-21,3,11,8,False,moderate,weak
Zelensky hails ‘excellent’ first call with Trump as proposals to end war in Ukraine emerge,25152,4471,2024-11-07 09:26:10,,https://novayagazeta.eu/articles/2024/11/07/zelensky-hails-excellent-first-call-with-trump-as-proposals-to-end-war-in-ukraine-emerge-en-news,shellfishb,0.91,Russia/Ukraine,0,worldnews,Zelensky hails excellent first call with Trump as proposals to end war in Ukraine emerge ,zelensky hails excellent first call trump proposals end war ukraine emerge,-0.0516,neutral,2024-11-07,3,11,9,True,moderate,weak
"Trump pledges 25% tariffs on Canada and Mexico, deeper tariffs on China",25054,4786,2024-11-26 00:33:07,,https://www.reuters.com/world/us/trump-promises-25-tariff-products-mexico-canada-2024-11-25/,joe4942,0.92,,0,worldnews,Trump pledges  tariffs on Canada and Mexico deeper tariffs on China ,trump pledges tariffs canada mexico deeper tariffs china,0.0,neutral,2024-11-26,1,11,0,False,moderate,weak
"Get North Korean troops out of Putin’s war now, Seoul warns Moscow",24815,1117,2024-10-21 12:32:12,,https://www.politico.eu/article/north-korea-troops-out-of-russia-now-south-korea-warns-moscow-war/,sumuenensa,0.96,Russia/Ukraine,0,worldnews,Get North Korean troops out of Putins war now Seoul warns Moscow ,get north korean troops putins war seoul warns moscow,-0.6486,negative,2024-10-21,0,10,12,True,extreme,strong
Ukraine confirms it destroyed major Russian ammunition depot,24583,358,2024-12-27 07:16:25,,https://tvpworld.com/84230135/ukraine-confirms-it-destroyed-major-russian-ammunition-depot,KrzyHooy,0.96,Russia/Ukraine,0,worldnews,Ukraine confirms it destroyed major Russian ammunition depot ,ukraine confirms destroyed major russian ammunition depot,-0.4939,negative,2024-12-27,4,12,7,False,moderate,weak
"Argentina's monthly inflation drops to 2.7%, the lowest level in 3 years",24558,2844,2024-11-13 02:17:12,,https://abcnews.go.com/International/wireStory/argentinas-monthly-inflation-drops-27-lowest-level-3-115787902,BlitzOrion,0.9,,0,worldnews,Argentinas monthly inflation drops to  the lowest level in  years ,argentinas monthly inflation drops lowest level years,-0.3818,negative,2024-11-13,2,11,2,False,moderate,weak
South Korea President Yoon declares martial law,24531,2810,2024-12-03 13:49:41,,https://www.reuters.com/world/asia-pacific/south-korea-president-yoon-declares-martial-law-2024-12-03/,TeaReim,0.95,,0,worldnews,South Korea President Yoon declares martial law ,south korea president yoon declares martial law,0.0,neutral,2024-12-03,1,12,13,False,moderate,weak
Trump adds Europe to the list of US trade partners he's threatening with tariffs,24346,2389,2024-12-24 11:43:21,,https://apnews.com/article/trump-europe-trade-tariffs-natural-gas-oil-08d762fdf17a0737aa6add3c9382c4bd,deadpools0,0.92,,0,worldnews,Trump adds Europe to the list of US trade partners hes threatening with tariffs ,trump adds europe list trade partners hes threatening tariffs,-0.5267,negative,2024-12-24,1,12,11,False,extreme,strong
NATO: North Korea sending troops to Ukraine would mark significant escalation,24320,1110,2024-10-21 17:30:04,,https://global.espreso.tv/military-news-nato-northkorea-sending-troops-to-ukraine-would-mark-significant-escalation,PieceAffectionate460,0.95,Russia/Ukraine,0,worldnews,NATO North Korea sending troops to Ukraine would mark significant escalation ,nato north korea sending troops ukraine would mark significant escalation,0.2023,positive,2024-10-21,0,10,17,False,moderate,weak
"Ukraine strikes 'only oil refinery operating' in Russia's Rostov Oblast, military says",24215,442,2024-12-19 10:18:29,,https://kyivindependent.com/ukraine-strikes-only-oil-refinery-operating-in-russias-rostov-oblast-military-says/,MothersMiIk,0.96,Russia/Ukraine,0,worldnews,Ukraine strikes only oil refinery operating in Russias Rostov Oblast military says ,ukraine strikes oil refinery operating russias rostov oblast military says,-0.3612,negative,2024-12-19,3,12,10,False,moderate,weak
Two Russian tankers carrying tonnes of fuel oil break in half and start sinking near Kerch Strait,24154,1667,2024-12-15 10:56:29,,https://www.pravda.com.ua/eng/news/2024/12/15/7489168/,Silly-avocatoe,0.95,Russia/Ukraine,0,worldnews,Two Russian tankers carrying tonnes of fuel oil break in half and start sinking near Kerch Strait ,two russian tankers carrying tonnes fuel oil break half start sinking near kerch strait,0.0,neutral,2024-12-15,6,12,10,False,moderate,weak
Russian General and hundreds of North Korean troops ‘killed in first UK-supplied storm Shadow missile’ strike,24040,835,2024-11-23 20:24:05,,https://www.gbnews.com/news/world/russian-general-hundreds-north-korean-troops-killed-uk-storm-shadow-missile-strike,[deleted],0.91,Russia/Ukraine,0,worldnews,Russian General and hundreds of North Korean troops killed in first UKsupplied storm Shadow missile strike ,russian general hundreds north korean troops killed first uksupplied storm shadow missile strike,-0.7184,negative,2024-11-23,5,11,20,False,extreme,strong
"Grocery prices set to rise as soil becomes ""unproductive""",23785,1919,2024-12-18 04:15:14,,https://www.newsweek.com/grocery-prices-set-rise-soil-becomes-unproductive-2001418,nothingarc,0.93,,0,worldnews,Grocery prices set to rise as soil becomes unproductive ,grocery prices set rise soil becomes unproductive,0.0,neutral,2024-12-18,2,12,4,False,moderate,weak
Finland Seizes Ship After Undersea Cable Is Cut,23704,669,2024-12-26 18:22:49,,https://www.nytimes.com/2024/12/26/world/europe/finland-estonia-cables-russia.html,HonkeyDonkey3000,0.97,Behind Soft Paywall,0,worldnews,Finland Seizes Ship After Undersea Cable Is Cut ,finland seizes ship undersea cable cut,-0.2732,negative,2024-12-26,3,12,18,False,moderate,weak
China dissuaded Putin from using nuclear weapons in Ukraine – US secretary of state,23448,1719,2025-01-04 09:35:45,,https://www.pravda.com.ua/eng/news/2025/01/4/7491993/,Silly-avocatoe,0.94,Russia/Ukraine,0,worldnews,China dissuaded Putin from using nuclear weapons in Ukraine  US secretary of state ,china dissuaded putin using nuclear weapons ukraine secretary state,-0.4404,negative,2025-01-04,5,1,9,False,moderate,weak
France and Britain greenlight Ukraine’s use of Storm Shadow missiles against Russia,23385,860,2024-11-17 20:42:43,,https://newsukraine.rbc.ua/news/france-and-britain-greenlight-ukraine-s-use-1731872568.html,TheRealMykola,0.96,Russia/Ukraine,0,worldnews,France and Britain greenlight Ukraines use of Storm Shadow missiles against Russia ,france britain greenlight ukraines use storm shadow missiles russia,0.0,neutral,2024-11-17,6,11,20,False,moderate,weak
Putin rejects ‘peace plan’ suggested by Trump and wants to achieve his military goals in Ukraine. Russian ruler explicitly rejected a plan considered by US President-elect Donald Trump’s team that would delay Ukraine’s membership in NATO as a condition for ending the Russia-Ukraine war.,23387,2184,2024-12-27 14:15:42,,https://www.pravda.com.ua/eng/news/2024/12/27/7490923/,Lion8330,0.95,Russia/Ukraine,0,worldnews,Putin rejects peace plan suggested by Trump and wants to achieve his military goals in Ukraine Russian ruler explicitly rejected a plan considered by US Presidentelect Donald Trumps team that would delay Ukraines membership in NATO as a condition for ending the RussiaUkraine war ,putin rejects peace plan suggested trump wants achieve military goals ukraine russian ruler explicitly rejected plan considered presidentelect donald trumps team would delay ukraines membership nato condition ending russiaukraine war,-0.8481,negative,2024-12-27,4,12,14,True,extreme,strong
"Zelenskyy says elections can be held after ""hot phase of war"" passes",23189,1617,2025-01-03 05:01:44,,https://www.pravda.com.ua/eng/news/2025/01/2/7491801/,eaglemaxie,0.93,Russia/Ukraine,0,worldnews,Zelenskyy says elections can be held after hot phase of war passes ,zelenskyy says elections held hot phase war passes,-0.5994,negative,2025-01-03,4,1,5,True,extreme,strong
Azerbaijani President demands compensation and admission of guilt from Russia for downed plane,23088,357,2024-12-29 14:55:02,,https://www.pravda.com.ua/eng/news/2024/12/29/7491215/,Silly-avocatoe,0.97,Russia/Ukraine,0,worldnews,Azerbaijani President demands compensation and admission of guilt from Russia for downed plane ,azerbaijani president demands compensation admission guilt russia downed plane,-0.2732,negative,2024-12-29,6,12,14,False,moderate,weak
Canada and India expel each other's diplomats in escalating dispute over an assassination,23022,2779,2024-10-14 17:34:01,,https://www.yahoo.com/news/india-recalls-ambassador-canada-growing-145120043.html,CreekHollow,0.95,,0,worldnews,Canada and India expel each others diplomats in escalating dispute over an assassination ,canada india expel others diplomats escalating dispute assassination,-0.8591,negative,2024-10-14,0,10,17,False,extreme,strong
"Ukraine's surrender hotline is tempting North Koreans to desert, promising they'll be well fed",22988,436,2024-10-30 16:12:43,,https://www.yahoo.com/news/ukraines-surrender-hotline-tempting-north-101157376.html,blllrrrrr,0.97,Russia/Ukraine,0,worldnews,Ukraines surrender hotline is tempting North Koreans to desert promising theyll be well fed ,ukraines surrender hotline tempting north koreans desert promising theyll well fed,0.5859,positive,2024-10-30,2,10,16,False,extreme,strong
US President Biden Authorizes $571 Million In Military Aid To Taiwan,22945,1259,2024-12-21 13:55:23,,https://www.ibtimes.com/us-president-biden-authorizes-571-million-military-aid-taiwan-3756456,Alexole1,0.93,,0,worldnews,US President Biden Authorizes  Million In Military Aid To Taiwan ,president biden authorizes million military aid taiwan,0.0,neutral,2024-12-21,5,12,13,False,moderate,weak
"Zelenskyy calls Putin ''deaf, bare-a**ed, mammoth and Voldemort'' in latest interview",22985,541,2025-01-06 07:03:37,,https://www.pravda.com.ua/eng/news/2025/01/6/7492147/,Silly-avocatoe,0.94,Russia/Ukraine,0,worldnews,Zelenskyy calls Putin deaf bareaed mammoth and Voldemort in latest interview ,zelenskyy calls putin deaf bareaed mammoth voldemort latest interview,0.0,neutral,2025-01-06,0,1,7,False,moderate,weak
Tears of joy and sadness as ‘disappeared’ Syrians emerge from Assad’s prisons,22884,655,2024-12-08 21:36:33,,https://www.theguardian.com/world/2024/dec/08/tears-of-joy-and-sadness-as-disappeared-syrians-emerge-from-assads-prisons,PandaMuffin1,0.97,,0,worldnews,Tears of joy and sadness as disappeared Syrians emerge from Assads prisons ,tears joy sadness disappeared syrians emerge assads prisons,-0.2263,negative,2024-12-08,6,12,21,False,moderate,weak
Boris Johnson calls for US$500 billion loan to Ukraine and its NATO membership date to be announced,22734,1246,2024-11-18 17:40:04,,https://www.pravda.com.ua/eng/news/2024/11/18/7485144/,Silly-avocatoe,0.92,Russia/Ukraine,0,worldnews,Boris Johnson calls for US billion loan to Ukraine and its NATO membership date to be announced ,boris johnson calls billion loan ukraine nato membership date announced,0.0,neutral,2024-11-18,0,11,17,False,moderate,weak
