title,score,comments,created_utc,selftext,url,author,upvote_ratio,flair,num_awards,subreddit,content,processed_content,sentiment,sentiment_label,created_date,week_day,month,hour,event_related,extreme_sentiment,strong_sentiment
Biden Allows Ukraine to Strike Russia With Long-Range U.S. Missiles,68138,5035,2024-11-17 18:06:21,,https://www.nytimes.com/2024/11/17/us/politics/biden-ukraine-russia-atacms-missiles.html?smid=nytcore-ios-share&amp;referringSource=articleShare,SportsGod3,0.91,Behind Soft Paywall,0,worldnews,Biden Allows Ukraine to Strike Russia With LongRange US Missiles ,biden allows ukraine strike russia longrange missiles,-0.128,negative,2024-11-17,6,11,18,False,moderate,weak
"Russia says Donald Trump's election win ""useful for us""",62256,7652,2024-11-06 10:21:04,,https://www.newsweek.com/russia-medvedev-trump-useful-1981117,NaiE007,0.73,Russia/Ukraine,0,worldnews,Russia says Donald Trumps election win useful for us ,russia says donald trumps election win useful,0.7717,positive,2024-11-06,2,11,10,True,extreme,strong
Zelenskyy: No world leader has the right to negotiate with Putin on behalf of Ukraine,59714,2008,2024-12-18 11:16:26,,https://www.pravda.com.ua/eng/news/2024/12/18/7489634/,Silly-avocatoe,0.92,Russia/Ukraine,0,worldnews,Zelenskyy No world leader has the right to negotiate with Putin on behalf of Ukraine ,zelenskyy world leader right negotiate putin behalf ukraine,0.0,neutral,2024-12-18,2,12,11,False,moderate,weak
"Server found in apartment funded by Russian government used AI to interfere with 2024 US elections | Department of Treasury December 31, 2024",56964,2324,2025-01-01 05:44:27,,https://home.treasury.gov/news/press-releases/jy2766,StatisticalPikachu,0.91,Russia/Iran sanctioned,0,worldnews,Server found in apartment funded by Russian government used AI to interfere with  US elections  Department of Treasury December   ,server found apartment funded russian government used interfere elections department treasury december,0.2023,positive,2025-01-01,2,1,5,True,moderate,weak
Russian Oligarch Found Dead in Moscow after Falling Out of Window,54848,4257,2024-10-21 11:14:13,,https://www.newsweek.com/russia-mysterious-death-oil-yukos-oligarch-rogachev-window-cancer-suicide-1972000,blllrrrrr,0.94,Russia/Ukraine,0,worldnews,Russian Oligarch Found Dead in Moscow after Falling Out of Window ,russian oligarch found dead moscow falling window,-0.7096,negative,2024-10-21,0,10,11,False,extreme,strong
A bomb kills the head of Russia’s nuclear defense forces and his assistant in Moscow,49757,1339,2024-12-17 08:19:00,,https://apnews.com/article/russia-explosion-head-of-nuclear-defense-forces-killed-9656bce946a9f552454df9debe5fbd18,Hefty-Relationship-8,0.95,Russia/Ukraine,0,worldnews,A bomb kills the head of Russias nuclear defense forces and his assistant in Moscow ,bomb kills head russias nuclear defense forces assistant moscow,-0.7351,negative,2024-12-17,1,12,8,False,extreme,strong
Spain to Enshrine Gay Marriage and Abortion Rights Into its Constitution so ‘They Cannot be Undone in the Future’,49106,911,2024-12-06 16:31:36,,https://www.theolivepress.es/spain-news/2024/12/06/spain-to-enshrine-gay-marriage-and-abortion-rights-into-its-constitution-so-they-cannot-be-undone-in-the-future/,Extreme_Hate2023,0.9,,0,worldnews,Spain to Enshrine Gay Marriage and Abortion Rights Into its Constitution so They Cannot be Undone in the Future ,spain enshrine gay marriage abortion rights constitution undone future,0.0,neutral,2024-12-06,4,12,16,False,moderate,weak
"Zelenskyy suggests he's prepared to end Ukraine war in return for NATO membership, even if Russia doesn't immediately return seized land",47893,3386,2024-11-29 19:21:35,,https://news.sky.com/story/zelenskyy-suggests-hes-prepared-to-end-ukraine-war-in-return-for-nato-membership-even-if-russia-doesnt-immediately-return-seized-land-13263085,KeyLog256,0.93,Russia/Ukraine,0,worldnews,Zelenskyy suggests hes prepared to end Ukraine war in return for NATO membership even if Russia doesnt immediately return seized land ,zelenskyy suggests hes prepared end ukraine war return nato membership even russia doesnt immediately return seized land,-0.4588,negative,2024-11-29,4,11,19,True,moderate,weak
"Bomb threats across multiple states traced to Russian email domains, FBI says",45687,735,2024-11-05 22:15:01,,https://kyivindependent.com/bomb-threats-across-multiple-states-traced-to-russian-email-domains-fbi-says/,Becauseyouarethebest,0.91,Russia/Ukraine,0,worldnews,Bomb threats across multiple states traced to Russian email domains FBI says ,bomb threats across multiple states traced russian email domains fbi says,-0.7184,negative,2024-11-05,1,11,22,False,extreme,strong
President Yoon Suk Yeol impeached,45066,1098,2024-12-14 08:01:58,,https://koreajoongangdaily.joins.com/news/2024-12-14/national/politics/President-Yoon-Suk-Yeol-impeached/2200691,ProfessionalOwn5490,0.96,South Korea,0,worldnews,President Yoon Suk Yeol impeached ,president yoon suk yeol impeached,0.0,neutral,2024-12-14,5,12,8,False,moderate,weak
"‘They’re girls, not wives’: Colombia votes to outlaw child marriage",44700,519,2024-11-15 02:48:20,,https://www.cnn.com/2024/11/14/americas/colombia-child-marriage-law-intl-latam/index.html?utm_medium=social&amp;utm_source=reddit,cnn,0.97,,0,worldnews,Theyre girls not wives Colombia votes to outlaw child marriage ,theyre girls wives colombia votes outlaw child marriage,0.0,neutral,2024-11-15,4,11,2,False,moderate,weak
Elon Musk’s Secret Conversations With Vladimir Putin,43934,2204,2024-10-25 04:01:34,,https://www.rawstory.com/amp/elon-musk-2669477305-2669477305,Turbulent_Art5743,0.86,Russia/Ukraine,0,worldnews,Elon Musks Secret Conversations With Vladimir Putin ,elon musks secret conversations vladimir putin,0.0,neutral,2024-10-25,4,10,4,False,moderate,weak
Over 100 women commit mass suicide in Sudan's Al Jazirah,43828,2260,2024-10-31 05:58:55,,https://www.albawaba.com/node/over-100-women-commit-mass-suicide-1591038,Youdi990,0.94,,0,worldnews,Over  women commit mass suicide in Sudans Al Jazirah ,women commit mass suicide sudans jazirah,-0.5106,negative,2024-10-31,3,10,5,False,extreme,strong
Mexico suggests it would impose its own tariffs to retaliate against any Trump tariffs,43751,4652,2024-11-26 16:23:54,,https://apnews.com/article/mexico-tariffs-trump-retaliate-sheinbaum-fac0b0c6ee8c425a928418de7332b74a,le_fromagee,0.91,,0,worldnews,Mexico suggests it would impose its own tariffs to retaliate against any Trump tariffs ,mexico suggests would impose tariffs retaliate trump tariffs,-0.296,negative,2024-11-26,1,11,16,False,moderate,weak
Zelenskyy: We Gave Away Our Nuclear Weapons and Got Full-Scale War and Death in Return,43356,1894,2024-10-22 22:47:44,,https://united24media.com/latest-news/zelenskyy-we-gave-away-our-nuclear-weapons-and-got-full-scale-war-and-death-in-return-3203,Naderium,0.92,Russia/Ukraine,0,worldnews,Zelenskyy We Gave Away Our Nuclear Weapons and Got FullScale War and Death in Return ,zelenskyy gave away nuclear weapons got fullscale war death return,-0.8934,negative,2024-10-22,1,10,22,True,extreme,strong
"After Syria, world must realise that Russia can be defeated – Polish PM",42565,1482,2024-12-09 10:45:10,,https://www.pravda.com.ua/eng/news/2024/12/8/7488259/,HydrolicKrane,0.92,Russia/Ukraine,0,worldnews,After Syria world must realise that Russia can be defeated  Polish PM ,syria world must realise russia defeated polish,-0.4767,negative,2024-12-09,0,12,10,False,moderate,weak
Russia-linked cable-cutting tanker seized by Finland ‘was loaded with spying equipment’,42258,1285,2024-12-27 17:38:31,,https://www.lloydslist.com/LL1151955/Russia-linked-cable-cutting-tanker-seized-by-Finland-was-loaded-with-spying-equipment,sn0r,0.96,Russia/Ukraine,0,worldnews,Russialinked cablecutting tanker seized by Finland was loaded with spying equipment ,russialinked cablecutting tanker seized finland loaded spying equipment,0.0,neutral,2024-12-27,4,12,17,False,moderate,weak
Sudan: Hundreds of Women Died by Suicide to Avoid Rape,41865,2049,2024-10-30 12:49:37,,https://newscentral.africa/sudan-hundreds-of-women-died-by-suicide-to-avoid-rape-hala-kirbi/amp/,Wrld-Competitive,0.94,,0,worldnews,Sudan Hundreds of Women Died by Suicide to Avoid Rape ,sudan hundreds women died suicide avoid rape,-0.9432,negative,2024-10-30,2,10,12,False,extreme,strong
Biden warned Iran that US would consider assassination attempt against Trump as declaration of war,41072,4103,2024-10-12 18:31:03,,https://www.1lurer.am/en/2024/10/12/Biden-warned-Iran-that-US-would-consider-assassination-attempt-against-Trump-as-declaration-of-war/1203125,kfireven,0.73,,0,worldnews,Biden warned Iran that US would consider assassination attempt against Trump as declaration of war ,biden warned iran would consider assassination attempt trump declaration war,-0.872,negative,2024-10-12,5,10,18,True,extreme,strong
Putin Asked Elon Musk Not to Deploy Starlink in Taiwan,39869,1546,2024-10-25 15:37:56,,https://www.pcmag.com/news/putin-reportedly-asked-elon-musk-not-to-deploy-starlink-in-taiwan,OkayButFoRealz,0.91,Russia/Ukraine,0,worldnews,Putin Asked Elon Musk Not to Deploy Starlink in Taiwan ,putin asked elon musk deploy starlink taiwan,0.0,neutral,2024-10-25,4,10,15,False,moderate,weak
"Biden surges arms to Ukraine, fearing Trump will halt U.S. aid",39753,2165,2024-12-02 12:51:29,,https://www.washingtonpost.com/national-security/2024/12/02/biden-trump-ukraine-russia/,superanth,0.91,Behind Soft Paywall,0,worldnews,Biden surges arms to Ukraine fearing Trump will halt US aid ,biden surges arms ukraine fearing trump halt aid,-0.5719,negative,2024-12-02,0,12,12,False,extreme,strong
Putin's youngest daughter 'living in Paris under a pseudonym',39728,2522,2024-11-28 20:42:22,,https://www.telegraph.co.uk/world-news/2024/11/28/putin-youngest-daughter-paris-pseudonym-luiza-rozova/,TheTelegraph,0.92,Russia/Ukraine,0,worldnews,Putins youngest daughter living in Paris under a pseudonym ,putins youngest daughter living paris pseudonym,0.0,neutral,2024-11-28,3,11,20,False,moderate,weak
Preliminary investigation confirms Russian missile caused Azerbaijan Airlines crash,39355,1577,2024-12-26 13:06:46,,https://www.euronews.com/2024/12/26/exclusive-preliminary-investigation-confirms-russian-missile-over-grozny-caused-aktau-cras,DomesticErrorist22,0.96,Russia/Ukraine,0,worldnews,Preliminary investigation confirms Russian missile caused Azerbaijan Airlines crash ,preliminary investigation confirms russian missile caused azerbaijan airlines crash,-0.4019,negative,2024-12-26,3,12,13,False,moderate,weak
Biden administration moves to forgive $4.7 billion of loans to Ukraine,38949,3524,2024-11-21 01:19:45,,https://www.reuters.com/world/biden-administrations-moves-forgive-47-billion-loans-ukraine-2024-11-20/,piponwa,0.86,Russia/Ukraine,0,worldnews,Biden administration moves to forgive  billion of loans to Ukraine ,biden administration moves forgive billion loans ukraine,0.2732,positive,2024-11-21,3,11,1,False,moderate,weak
"The Guardian, one of the main news outlets in UK, will no longer post on Elon Musk’s X",38392,1891,2024-11-13 12:35:35,,https://www.theguardian.com/media/2024/nov/13/the-guardian-no-longer-post-on-x-twitter-elon-musk,biwook,0.89,,0,worldnews,The Guardian one of the main news outlets in UK will no longer post on Elon Musks X ,guardian one main news outlets longer post elon musks,0.0,neutral,2024-11-13,2,11,12,False,moderate,weak
Biden administration to allow American military contractors to deploy to Ukraine for first time since Russia’s invasion | CNN Politics,38119,2573,2024-11-08 18:53:06,,https://edition.cnn.com/2024/11/08/politics/biden-administration-american-military-contractors-deploy-ukraine/index.html,piponwa,0.93,Russia/Ukraine,0,worldnews,Biden administration to allow American military contractors to deploy to Ukraine for first time since Russias invasion  CNN Politics ,biden administration allow american military contractors deploy ukraine first time since russias invasion cnn politics,0.2263,positive,2024-11-08,4,11,18,False,moderate,weak
"Zelenskyy: Ukraine will not cede territory, regardless of US election results",38041,1472,2024-10-31 21:25:31,,https://www.pravda.com.ua/eng/news/2024/10/31/7482361/,Silly-avocatoe,0.93,Russia/Ukraine,0,worldnews,Zelenskyy Ukraine will not cede territory regardless of US election results ,zelenskyy ukraine cede territory regardless election results,0.0,neutral,2024-10-31,3,10,21,True,moderate,weak
Russian Ruble Collapses As Putin's Economy in Trouble,37518,2916,2024-11-27 14:41:36,,https://www.newsweek.com/russia-ruble-dollar-currency-economy-1992332,blllrrrrr,0.92,Russia/Ukraine,0,worldnews,Russian Ruble Collapses As Putins Economy in Trouble ,russian ruble collapses putins economy trouble,-0.5994,negative,2024-11-27,2,11,14,False,extreme,strong
Syrian government appears to have fallen in stunning end to 50-year rule of Assad family,37536,2005,2024-12-08 04:17:13,,https://apnews.com/article/syria-assad-sweida-daraa-homs-hts-qatar-7f65823bbf0a7bd331109e8dff419430,Strongbow85,0.97,,0,worldnews,Syrian government appears to have fallen in stunning end to year rule of Assad family ,syrian government appears fallen stunning end year rule assad family,0.0258,neutral,2024-12-08,6,12,4,False,moderate,weak
Trump refuses to rule out use of military force to take control of Greenland and the Panama Canal,37501,7932,2025-01-07 17:35:13,,https://apnews.com/article/trump-biden-offshore-drilling-gulf-of-america-fa66f8d072eb39c00a8128a8941ede75,lukalux3,0.84,,0,worldnews,Trump refuses to rule out use of military force to take control of Greenland and the Panama Canal ,trump refuses rule use military force take control greenland panama canal,0.0,neutral,2025-01-07,1,1,17,False,moderate,weak
"Power goes out on entire island of Cuba, leaving 10 million people without electricity",37268,3122,2024-10-19 00:42:42,,https://www.nbcnews.com/news/latino/power-goes-entire-island-cuba-leaving-10-million-people-dark-rcna176169,Eedat,0.95,,0,worldnews,Power goes out on entire island of Cuba leaving  million people without electricity ,power goes entire island cuba leaving million people without electricity,0.0,neutral,2024-10-19,5,10,0,False,moderate,weak
"Russia Lost 10,000 Troops in a Single Week: Kyiv",36909,2251,2024-10-28 13:14:07,,https://www.newsweek.com/russia-casualties-ukraine-fighting-1975746,Wrld-Competitive,0.91,Russia/Ukraine,0,worldnews,Russia Lost  Troops in a Single Week Kyiv ,russia lost troops single week kyiv,-0.3182,negative,2024-10-28,0,10,13,False,moderate,weak
King Charles 'won't stand in way' if Australia chooses to axe monarchy and become republic,36850,2088,2024-10-12 09:54:57,,https://www.lbc.co.uk/news/king-charles-wont-stand-in-way-australia-republic/,kwentongskyblue,0.94,,0,worldnews,King Charles wont stand in way if Australia chooses to axe monarchy and become republic ,king charles wont stand way australia chooses axe monarchy become republic,-0.1027,negative,2024-10-12,5,10,9,False,moderate,weak
Zelenskyy on permission to strike Russia: The missiles will speak for themselves,36691,2000,2024-11-18 01:55:10,,https://www.pravda.com.ua/eng/news/2024/11/17/7484979/,eaglemaxie,0.92,Russia/Ukraine,0,worldnews,Zelenskyy on permission to strike Russia The missiles will speak for themselves ,zelenskyy permission strike russia missiles speak,-0.128,negative,2024-11-18,0,11,1,False,moderate,weak
Assassinated Hamas Leader Had UN Employee ID on Body at Time of Death,36374,2756,2024-10-17 22:57:40,,https://www.latintimes.com/assassinated-hamas-leader-had-un-employee-id-body-time-death-562569,ewzetf,0.75,Israel/Palestine,0,worldnews,Assassinated Hamas Leader Had UN Employee ID on Body at Time of Death ,assassinated hamas leader employee body time death,-0.5994,negative,2024-10-17,3,10,22,False,extreme,strong
"‘Black Day for Russia’ – Ukraine Crushes Moscow Offensive in Kursk, Destroying Battalion and Over 200 Soldiers",36000,1073,2024-11-14 02:17:13,,https://www.kyivpost.com/post/42116,strimholov,0.92,Russia/Ukraine,0,worldnews,Black Day for Russia  Ukraine Crushes Moscow Offensive in Kursk Destroying Battalion and Over  Soldiers ,black day russia ukraine crushes moscow offensive kursk destroying battalion soldiers,-0.8591,negative,2024-11-14,3,11,2,False,extreme,strong
Zelenskyy says ‘suicidal’ to offer Putin concessions on Ukraine,35785,1917,2024-11-07 17:26:00,,https://www.courthousenews.com?page_id=1023996,BobbyLucero,0.93,Russia/Ukraine,0,worldnews,Zelenskyy says suicidal to offer Putin concessions on Ukraine ,zelenskyy says suicidal offer putin concessions ukraine,-0.6705,negative,2024-11-07,3,11,17,False,extreme,strong
Zelenskyy says Ukraine will be forced to fight against North Korea as he calls on allies to increase pressure on Russia  ,35420,1345,2024-10-27 21:44:33,,https://www.businessinsider.com/zelenskyy-says-ukraine-will-be-forced-fight-against-north-korea-2024-10,BobbyLucero,0.92,Behind Soft Paywall,0,worldnews,Zelenskyy says Ukraine will be forced to fight against North Korea as he calls on allies to increase pressure on Russia   ,zelenskyy says ukraine forced fight north korea calls allies increase pressure russia,-0.6705,negative,2024-10-27,6,10,21,False,extreme,strong
Russia is likely behind poisoning of former Ukrainian President Yushchenko back in 2004 – US intelligence,35310,804,2024-11-23 13:22:50,,https://www.pravda.com.ua/eng/news/2024/11/23/7485985/,Silly-avocatoe,0.94,Russia/Ukraine,0,worldnews,Russia is likely behind poisoning of former Ukrainian President Yushchenko back in   US intelligence ,russia likely behind poisoning former ukrainian president yushchenko back intelligence,-0.1779,negative,2024-11-23,5,11,13,False,moderate,weak
"Kim Jong-un bans hotdogs for North Koreans, cooking them an act of treason",35103,2653,2025-01-06 22:20:59,,https://www.nzherald.co.nz/world/kim-jong-un-bans-hotdogs-for-north-koreans-cooking-them-an-act-of-treason/TKN3HJF3HRHZZHCCJ5L7EPF66Q/,CrazyAssBlindKid,0.9,North Korea,0,worldnews,Kim Jongun bans hotdogs for North Koreans cooking them an act of treason ,kim jongun bans hotdogs north koreans cooking act treason,-0.4404,negative,2025-01-06,0,1,22,False,moderate,weak
Trudeau opposes allowing Russia to keep ‘an inch’ of Ukrainian territory,34969,1828,2024-11-25 21:54:55,,https://www.theglobeandmail.com/politics/article-trudeau-opposes-russia-annexing-ukraine-territory/,ubcstaffer123,0.93,Behind Soft Paywall,0,worldnews,Trudeau opposes allowing Russia to keep an inch of Ukrainian territory ,trudeau opposes allowing russia keep inch ukrainian territory,0.0,neutral,2024-11-25,0,11,21,False,moderate,weak
"Europe will not allow attacks, says France, after Trump Greenland threat",36434,4130,2025-01-08 12:57:15,,https://www.bbc.com/news/articles/ckg9gvg3452o?xtor=AL-99999-%5Bpartner%5D-%5Bbbc.news.twitter%5D-%5Bheadline%5D-%5Bnews%5D-%5Bbizdev%5D-%5Bisapi%5D&amp;at_b,ParsleyMean3012,0.9,,0,worldnews,Europe will not allow attacks says France after Trump Greenland threat ,europe allow attacks says france trump greenland threat,-0.6597,negative,2025-01-08,2,1,12,False,extreme,strong
Zelensky says he needs Nato guarantees before entering peace talks with 'killer' Putin,34168,1667,2024-12-01 18:20:41,,https://www.telegraph.co.uk/world-news/2024/12/01/ukraine-zelensky-demands-nato-guarantees-peace-talks-putin/,TheTelegraph,0.93,Russia/Ukraine,0,worldnews,Zelensky says he needs Nato guarantees before entering peace talks with killer Putin ,zelensky says needs nato guarantees entering peace talks killer putin,-0.2023,negative,2024-12-01,6,12,18,True,moderate,weak
Biden plans to use billions in seized Russian assets to fund Ukraine aid,34161,781,2024-10-23 23:09:15,,https://www.courthousenews.com?page_id=1018936,BobbyLucero,0.94,Russia/Ukraine,0,worldnews,Biden plans to use billions in seized Russian assets to fund Ukraine aid ,biden plans use billions seized russian assets fund ukraine aid,0.1779,positive,2024-10-23,2,10,23,False,moderate,weak
Germany’s SPD Calls for Antitrust Act to Clip Elon Musk’s Power,33745,891,2024-12-22 19:45:39,,https://www.bloomberg.com/news/articles/2024-12-22/germany-s-spd-calls-for-antitrust-act-to-clip-elon-musk-s-power,bloomberg,0.93,Behind Soft Paywall,0,worldnews,Germanys SPD Calls for Antitrust Act to Clip Elon Musks Power ,germanys spd calls antitrust act clip elon musks power,0.0,neutral,2024-12-22,6,12,19,False,moderate,weak
"North Korean troops open fire on Russian unit, Ukraine's military intelligence claims",33313,1076,2024-12-15 14:27:04,,https://kyivindependent.com/north-korean-troops-open-fire-on-russian-unit-ukraines-military-intelligence-claims/,AdSpecialist6598,0.94,Russia/Ukraine,0,worldnews,North Korean troops open fire on Russian unit Ukraines military intelligence claims ,north korean troops open fire russian unit ukraines military intelligence claims,0.1779,positive,2024-12-15,6,12,14,False,moderate,weak
"China hacked phones of Donald Trump's family, says FBI",33240,1057,2024-10-30 03:06:48,,https://www.telegraph.co.uk/us/politics/2024/10/29/china-hacked-phones-donald-trump-family-says-fbi/,DoremusJessup,0.93,,0,worldnews,China hacked phones of Donald Trumps family says FBI ,china hacked phones donald trumps family says fbi,-0.4019,negative,2024-10-30,2,10,3,False,moderate,weak
Report: Russia plotted to start fires on planes bound for Canada and the U.S.,33108,1312,2024-11-04 19:42:52,,https://www.shorelinebeacon.com/news/canada/report-russia-plotted-to-start-fires-on-planes-bound-for-canada-and-the-u-s,TheDarthSnarf,0.93,Russia/Ukraine,0,worldnews,Report Russia plotted to start fires on planes bound for Canada and the US ,report russia plotted start fires planes bound canada,0.0,neutral,2024-11-04,0,11,19,False,moderate,weak
Russian air missile accident emerges as probable cause of Azerbaijan Airlines crash tragedy,31993,1609,2024-12-25 19:34:24,,https://www.euronews.com/2024/12/25/azerbaijani-passenger-plane-crashes-near-kazakh-city-of-aktau,Seek_Adventure,0.94,Russia/Ukraine,0,worldnews,Russian air missile accident emerges as probable cause of Azerbaijan Airlines crash tragedy ,russian air missile accident emerges probable cause azerbaijan airlines crash tragedy,-0.8807,negative,2024-12-25,2,12,19,False,extreme,strong
Sweden's Social Democrats want to activate NATO's Article 4 after the cable sabotage in the Baltic Sea ,31611,910,2024-12-28 18:55:30,,https://swedenherald.com/article/hultqvist-on-the-baltic-sea-activate-natos-article-4,TemperateStone,0.96,,0,worldnews,Swedens Social Democrats want to activate NATOs Article  after the cable sabotage in the Baltic Sea  ,swedens social democrats want activate natos article cable sabotage baltic sea,-0.4767,negative,2024-12-28,5,12,18,False,moderate,weak
Japan to give Ukraine US$3 billion from proceeds of frozen Russian assets,31426,349,2024-12-26 01:44:37,,https://www.pravda.com.ua/eng/news/2024/12/25/7490715/,eaglemaxie,0.97,Russia/Ukraine,0,worldnews,Japan to give Ukraine US billion from proceeds of frozen Russian assets ,japan give ukraine billion proceeds frozen russian assets,0.1779,positive,2024-12-26,3,12,1,False,moderate,weak
Taliban bars Afghan women from hearing each other's voices,31334,2567,2024-10-29 20:42:32,,https://nationalpost.com/news/world/taliban-bars-afghan-women-from-hearing-each-other?utm_source=reddit&amp;utm_medium=organic&amp;utm_campaign=NP_social,nationalpost,0.93,,0,worldnews,Taliban bars Afghan women from hearing each others voices ,taliban bars afghan women hearing others voices,0.0,neutral,2024-10-29,1,10,20,False,moderate,weak
North Korean troops deserting Ukraine frontline days after arrival,31056,1127,2024-10-16 12:16:59,,https://www.newsweek.com/north-korean-troops-deserting-ukraine-frontline-hours-after-arrival-report-1969726,superanth,0.95,Russia/Ukraine,0,worldnews,North Korean troops deserting Ukraine frontline days after arrival ,north korean troops deserting ukraine frontline days arrival,0.0,neutral,2024-10-16,2,10,12,False,moderate,weak
Forbes: Elon Musk Pushes For Britain’s King Charles To Dissolve Parliament—As Lawmakers Say Tesla CEO Is ‘Misinformed’,31045,2953,2025-01-05 06:36:19,,https://www.forbes.com/sites/tylerroush/2025/01/04/elon-musk-pushes-for-britains-king-charles-to-dissolve-parliament-as-lawmakers-say-tesla-ceo-is-misinformed/,BothZookeepergame612,0.91,,0,worldnews,Forbes Elon Musk Pushes For Britains King Charles To Dissolve ParliamentAs Lawmakers Say Tesla CEO Is Misinformed ,forbes elon musk pushes britains king charles dissolve parliamentas lawmakers say tesla ceo misinformed,-0.3818,negative,2025-01-05,6,1,6,False,moderate,weak
"North Korean troops so 'poorly trained' that Putin army yet to throw them into battle, say western officials",30875,1997,2024-12-05 20:46:42,,https://www.standard.co.uk/news/politics/north-korean-troops-russia-ukraine-vladimir-putin-war-b1198384.html,Yveliad,0.92,Russia/Ukraine,0,worldnews,North Korean troops so poorly trained that Putin army yet to throw them into battle say western officials ,north korean troops poorly trained putin army yet throw battle say western officials,-0.3818,negative,2024-12-05,3,12,20,False,moderate,weak
"Anyone Who Supports Terrorist Organisations Should Be Deported, Swedish Migration Minister Says",30630,2809,2024-11-02 01:39:48,,https://schengen.news/anyone-who-supports-terrorist-organisations-should-be-deported-swedish-migration-minister-says/,Silly-avocatoe,0.91,,0,worldnews,Anyone Who Supports Terrorist Organisations Should Be Deported Swedish Migration Minister Says ,anyone supports terrorist organisations deported swedish migration minister says,-0.4939,negative,2024-11-02,5,11,1,False,moderate,weak
