title,score,comments,created_utc,selftext,url,author,upvote_ratio,flair,num_awards,subreddit,content,processed_content,sentiment,sentiment_label,created_date,week_day,month,hour,event_related,extreme_sentiment,strong_sentiment
Fury in Russia at missile move but Putin so far silent,14119,1097,2024-11-18 09:24:18,,https://www.bbc.com/news/articles/cvg5l1220zxo,BobbyLucero,0.95,Russia/Ukraine,0,worldnews,Fury in Russia at missile move but Putin so far silent ,fury russia missile move putin far silent,-0.5719,negative,2024-11-18,0,11,9,False,extreme,strong
France Allows Ukraine to Strike Russia: “No Red Lines” in Defense Support,13999,622,2024-11-23 16:05:45,,https://united24media.com/latest-news/france-allows-ukraine-to-strike-russia-no-red-lines-in-defense-support-3959,RIPBOZOBEEBO,0.97,Russia/Ukraine,0,worldnews,France Allows Ukraine to Strike Russia No Red Lines in Defense Support ,france allows ukraine strike russia red lines defense support,0.4019,positive,2024-11-23,5,11,16,False,moderate,weak
Ukraine ‘claims responsibility’ for killing senior Russian general in Moscow scooter bombing,13931,402,2024-12-17 09:01:42,,https://www.telegraph.co.uk/world-news/2024/12/17/bomb-kills-senior-russian-general-igor-kirillov-moscow/,TheTelegraph,0.98,Russia/Ukraine,0,worldnews,Ukraine claims responsibility for killing senior Russian general in Moscow scooter bombing ,ukraine claims responsibility killing senior russian general moscow scooter bombing,-0.6597,negative,2024-12-17,1,12,9,False,extreme,strong
Ukrainian brigade destroys North Korean Bulsae-4 system in Kharkiv Oblast,13900,270,2024-12-01 03:50:15,,https://english.nv.ua/nation/bulsae-4-soldiers-of-the-third-assault-brigade-strike-dprk-complex-in-kharkiv-oblast-50470718.html,Silly-avocatoe,0.96,Russia/Ukraine,0,worldnews,Ukrainian brigade destroys North Korean Bulsae system in Kharkiv Oblast ,ukrainian brigade destroys north korean bulsae system kharkiv oblast,-0.5574,negative,2024-12-01,6,12,3,False,extreme,strong
'Putin is weaker than US' — Zelensky outlines US role in ending war in Ukraine,13836,493,2024-11-20 13:19:26,,https://kyivindependent.com/putin-is-weaker-than-us-zelensky-says/,blllrrrrr,0.95,Russia/Ukraine,0,worldnews,Putin is weaker than US  Zelensky outlines US role in ending war in Ukraine ,putin weaker zelensky outlines role ending war ukraine,-0.7783,negative,2024-11-20,2,11,13,True,extreme,strong
"Trump speaks with Mexico’s president, claims an agreement to effectively close the border",13837,2271,2024-11-28 02:56:25,,https://apnews.com/article/trump-mexico-tariffs-sheinbaum-fentanyl-5fd2fc21950f47e5dbaf5c062c4725b7,Leviabs,0.87,,0,worldnews,Trump speaks with Mexicos president claims an agreement to effectively close the border ,trump speaks mexicos president claims agreement effectively close border,0.7269,positive,2024-11-28,3,11,2,False,extreme,strong
UK Right Warns Trump Allies That Musk’s Posts Have Gone Too Far,13833,902,2025-01-04 22:39:03,,https://www.bnnbloomberg.ca/business/company-news/2025/01/03/uk-right-warns-trump-allies-that-musks-posts-have-gone-too-far/,JayR_97,0.94,,0,worldnews,UK Right Warns Trump Allies That Musks Posts Have Gone Too Far ,right warns trump allies musks posts gone far,-0.1027,negative,2025-01-04,5,1,22,True,moderate,weak
At least 28 dead in South Korean plane crash,13720,1099,2024-12-29 01:32:13,,https://www.bbc.com/news/articles/c3we2p3l36jo,ConfessionsPartII,0.96,179 presumed dead only 2 survivors*,0,worldnews,At least  dead in South Korean plane crash ,least dead south korean plane crash,0.1882,positive,2024-12-29,6,12,1,False,moderate,weak
Russia tells citizens not to travel to United States,13722,1037,2024-12-11 13:32:03,,https://www.aljazeera.com/amp/news/2024/12/11/russia-tells-citizens-not-to-travel-to-united-states,MothersMiIk,0.96,Russia/Ukraine,0,worldnews,Russia tells citizens not to travel to United States ,russia tells citizens travel united states,0.4215,positive,2024-12-11,2,12,13,False,moderate,weak
"“This is inhumane"": Britain and the US react to Russia's Christmas attack on Ukraine | УНН",13568,1011,2024-12-25 14:48:44,,https://unn.ua/en/news/this-is-inhumane-britain-and-the-us-react-to-russias-christmas-attack-on-ukraine,Silly-avocatoe,0.95,Russia/Ukraine,0,worldnews,This is inhumane Britain and the US react to Russias Christmas attack on Ukraine   ,inhumane britain react russias christmas attack ukraine,-0.4767,negative,2024-12-25,2,12,14,False,moderate,weak
Artificial Intelligence Raises Ukrainian Drone Kill Rates to 80%,13559,959,2024-10-15 00:14:18,,https://www.kyivpost.com/post/40500,BothZookeepergame612,0.94,Russia/Ukraine,0,worldnews,Artificial Intelligence Raises Ukrainian Drone Kill Rates to  ,artificial intelligence raises ukrainian drone kill rates,-0.3818,negative,2024-10-15,1,10,0,False,moderate,weak
South Korean President Yoon says he will lift martial law after parliament vote,13552,988,2024-12-03 19:42:47,,https://www.reuters.com/world/asia-pacific/south-koreas-yoon-says-he-will-lift-martial-law-after-parliament-vote-2024-12-03/,gfzgfx,0.97,,0,worldnews,South Korean President Yoon says he will lift martial law after parliament vote ,south korean president yoon says lift martial law parliament vote,0.0,neutral,2024-12-03,1,12,19,False,moderate,weak
Orbán threatens to mess with Ukraine aid to help Trump,13470,501,2024-10-14 09:14:38,,https://www.politico.eu/article/viktor-orban-threaten-ukraine-aid-help-donald-trump/,pabinudake,0.93,Russia/Ukraine,0,worldnews,Orbn threatens to mess with Ukraine aid to help Trump ,orbn threatens mess ukraine aid help trump,-0.34,negative,2024-10-14,0,10,9,False,moderate,weak
Poland reminds Musk that foreign interference in its elections is illegal,13560,335,2025-01-07 18:31:30,,https://notesfrompoland.com/2025/01/07/poland-reminds-musk-that-foreign-interference-in-its-elections-is-illegal/,BubsyFanboy,0.98,,0,worldnews,Poland reminds Musk that foreign interference in its elections is illegal ,poland reminds musk foreign interference elections illegal,-0.5574,negative,2025-01-07,1,1,18,True,extreme,strong
Russia wants Kursk back before negotiations. Ukraine isn’t budging. ,13449,518,2024-11-16 14:49:55,,https://www.washingtonpost.com/world/2024/11/16/russia-wants-kursk-back-before-negotiations-ukraine-isnt-budging/?utm_campaign=wp_main&amp;utm_medium=social&amp;utm_source=reddit.com,washingtonpost,0.96,Behind Soft Paywall,0,worldnews,Russia wants Kursk back before negotiations Ukraine isnt budging  ,russia wants kursk back negotiations ukraine isnt budging,0.0,neutral,2024-11-16,5,11,14,False,moderate,weak
"Ukraine, US have 'potential for stronger cooperation,' Zelensky says following Trump victory",13383,1489,2024-11-06 21:37:51,,https://kyivindependent.com/ukraine-us-have-potential-for-stronger-cooperation-zelensky-says-following-trump-victory/,maysarivers,0.92,Russia/Ukraine,0,worldnews,Ukraine US have potential for stronger cooperation Zelensky says following Trump victory ,ukraine potential stronger cooperation zelensky says following trump victory,0.3818,positive,2024-11-06,2,11,21,False,moderate,weak
Putin approves new budget with record defense spending: around 32.5% of the 2025 budget — or 13.5 trillion rubles (€119 billion) —  has been allocated for national defense,13359,1023,2024-12-01 17:12:06,,https://www.politico.eu/article/putin-russia-budget-moscow-record-defense-spending-kremlin-war-ukraine/,giuliomagnifico,0.97,Russia/Ukraine,0,worldnews,Putin approves new budget with record defense spending around  of the  budget  or  trillion rubles  billion   has been allocated for national defense ,putin approves new budget record defense spending around budget trillion rubles billion allocated national defense,0.5719,positive,2024-12-01,6,12,17,False,extreme,strong
US threatens Israel: Resolve humanitarian crisis in Gaza or face arms embargo - report,13302,1907,2024-10-15 13:07:18,,https://www.jpost.com/breaking-news/article-824725,BringbackDreamBars,0.89,Israel/Palestine,0,worldnews,US threatens Israel Resolve humanitarian crisis in Gaza or face arms embargo  report ,threatens israel resolve humanitarian crisis gaza face arms embargo report,-0.6249,negative,2024-10-15,1,10,13,False,extreme,strong
Russia recruits hundreds of Yemeni Houthis for war against Ukraine – FT,13280,1252,2024-11-24 12:00:50,,https://newsukraine.rbc.ua/news/russia-recruits-hundreds-of-yemeni-houthis-1732440295.html,alimanski,0.93,Russia/Ukraine,0,worldnews,Russia recruits hundreds of Yemeni Houthis for war against Ukraine  FT ,russia recruits hundreds yemeni houthis war ukraine,-0.5994,negative,2024-11-24,6,11,12,True,extreme,strong
South Korean parliament votes to lift president’s martial law declaration,13155,777,2024-12-03 16:18:34,,https://www.cnbc.com/2024/12/03/south-korean-parliament-votes-to-lift-presidents-martial-law-declaration.html,j4_jjjj,0.97,,0,worldnews,South Korean parliament votes to lift presidents martial law declaration ,south korean parliament votes lift presidents martial law declaration,0.0,neutral,2024-12-03,1,12,16,False,moderate,weak
"63% of Ukrainians ready to endure the war as long as necessary, survey shows",13118,539,2024-11-04 13:51:34,,https://kyivindependent.com/63-percent-of-ukrainians-ready-to-endure-the-war-as-long-as-necessary-survey-shows/,Red_Franklin,0.96,Russia/Ukraine,0,worldnews, of Ukrainians ready to endure the war as long as necessary survey shows ,ukrainians ready endure war long necessary survey shows,-0.34,negative,2024-11-04,0,11,13,True,moderate,weak
"Sixty-mile drag mark found near damaged Baltic Sea cable, says Finland ",12953,374,2024-12-30 19:25:05,,https://www.theguardian.com/world/2024/dec/30/finnish-investigators-into-suspected-sabotage-find-100km-trail-on-baltic-sea-bed,Jay_CD,0.98,,0,worldnews,Sixtymile drag mark found near damaged Baltic Sea cable says Finland  ,sixtymile drag mark found near damaged baltic sea cable says finland,-0.5859,negative,2024-12-30,0,12,19,False,extreme,strong
"Russia loses almost 46,000 troops, over $3 billion worth of military equipment in November, Defense Ministry says",12916,649,2024-12-01 21:01:41,,https://kyivindependent.com/russia-loses-record-almost-46-000-troops-over-3-billion-worth-of-military-equipment-in-november-defense-ministry-says/,Yveliad,0.97,Russia/Ukraine,0,worldnews,Russia loses almost  troops over  billion worth of military equipment in November Defense Ministry says ,russia loses almost troops billion worth military equipment november defense ministry says,-0.0422,neutral,2024-12-01,6,12,21,False,moderate,weak
"Zelenskyy: We will continue strikes on Russian military facilities, increasingly relying on domestically produced weapons",12909,341,2024-12-21 18:16:38,,https://www.pravda.com.ua/eng/news/2024/12/21/7490168/,Silly-avocatoe,0.97,Russia/Ukraine,0,worldnews,Zelenskyy We will continue strikes on Russian military facilities increasingly relying on domestically produced weapons ,zelenskyy continue strikes russian military facilities increasingly relying domestically produced weapons,-0.6597,negative,2024-12-21,5,12,18,False,extreme,strong
IDF checking if Hamas leader Yahya Sinwar killed in Gaza strike,12805,1695,2024-10-17 12:54:14,,https://m.jpost.com/breaking-news/article-825018,CaseEnvironmental824,0.88,Sinwar confirmed dead*,0,worldnews,IDF checking if Hamas leader Yahya Sinwar killed in Gaza strike ,idf checking hamas leader yahya sinwar killed gaza strike,-0.7184,negative,2024-10-17,3,10,12,True,extreme,strong
Russian missile designer eliminated by Ukrainian Intelligence,12794,340,2024-12-12 12:11:06,,https://newsukraine.rbc.ua/news/russian-official-responsible-for-missile-1734001513.html,strimholov,0.96,Russia/Ukraine,0,worldnews,Russian missile designer eliminated by Ukrainian Intelligence ,russian missile designer eliminated ukrainian intelligence,0.4767,positive,2024-12-12,3,12,12,False,moderate,weak
Jewish school in Canada hit by gunfire for second time,12790,572,2024-10-13 05:02:04,,https://www.france24.com/en/live-news/20241012-jewish-school-in-canada-hit-by-gunfire-for-second-time,DoremusJessup,0.91,,0,worldnews,Jewish school in Canada hit by gunfire for second time ,jewish school canada hit gunfire second time,0.0,neutral,2024-10-13,6,10,5,False,moderate,weak
"Nissan, Honda announce plans to merge, creating world’s No. 3 automaker",12735,1013,2024-12-23 08:40:31,,https://www.cnn.com/2024/12/23/business/nissan-honda-merge-automakers-intl-hnk?cid=ios_app,perplexed-redditor,0.98,,0,worldnews,Nissan Honda announce plans to merge creating worlds No  automaker ,nissan honda announce plans merge creating worlds automaker,0.296,positive,2024-12-23,0,12,8,False,moderate,weak
NATO Military Chief Says Troops Would Be on Ground if Not for Russian Nukes,12687,1150,2024-11-10 20:51:03,,https://www.newsweek.com/nato-russia-nuclear-weapons-ukraine-ground-troops-rob-bauer-1983425,VictorEmmanuelIV,0.94,Russia/Ukraine,0,worldnews,NATO Military Chief Says Troops Would Be on Ground if Not for Russian Nukes ,nato military chief says troops would ground russian nukes,0.0,neutral,2024-11-10,6,11,20,False,moderate,weak
'Backbone of Iran's missile industry' destroyed by IAF strikes on Islamic Republic,12671,382,2024-10-27 03:19:31,,https://www.jpost.com/middle-east/iran-news/article-826205,yuri_2022,0.94,,0,worldnews,Backbone of Irans missile industry destroyed by IAF strikes on Islamic Republic ,backbone irans missile industry destroyed iaf strikes islamic republic,-0.6908,negative,2024-10-27,6,10,3,False,extreme,strong
"Biden rushing assistance to Ukraine, with aid uncertain under Trump",12643,821,2024-11-07 13:42:25,,https://www.reuters.com/world/white-house-plans-rush-military-aid-ukraine-by-inauguration-day-politico-reports-2024-11-06/,blllrrrrr,0.96,Russia/Ukraine,0,worldnews,Biden rushing assistance to Ukraine with aid uncertain under Trump ,biden rushing assistance ukraine aid uncertain trump,-0.296,negative,2024-11-07,3,11,13,False,moderate,weak
Ontario premier says US energy exports will be cut off if Trump imposes sweeping tariffs on Canada,12636,1336,2024-12-12 14:19:00,,https://apnews.com/article/canada-interest-rate-cut-trump-tariffs-c0ef920ffb02ea0531c93516abad64e0,RollSafer,0.96,,0,worldnews,Ontario premier says US energy exports will be cut off if Trump imposes sweeping tariffs on Canada ,ontario premier says energy exports cut trump imposes sweeping tariffs canada,-0.1027,negative,2024-12-12,3,12,14,False,moderate,weak
Russians announce evacuation from Donetsk Oblast's Yenakiieve after alleged hit on ammo depot ,12627,379,2024-12-10 14:31:28,,https://www.pravda.com.ua/eng/news/2024/12/10/7488516/,eaglemaxie,0.97,Russia/Ukraine,0,worldnews,Russians announce evacuation from Donetsk Oblasts Yenakiieve after alleged hit on ammo depot  ,russians announce evacuation donetsk oblasts yenakiieve alleged hit ammo depot,0.0,neutral,2024-12-10,1,12,14,False,moderate,weak
Zelenskyy rebuffs Trump’s proposal for rapid peace deal in Ukraine war,12549,1686,2024-11-08 08:17:15,,https://www.politico.eu/article/volodymyr-zelenskyy-ukraine-war-defense-russia-kyiv-moscow-budapest-journalists/,Tac0321,0.95,Russia/Ukraine,0,worldnews,Zelenskyy rebuffs Trumps proposal for rapid peace deal in Ukraine war ,zelenskyy rebuffs trumps proposal rapid peace deal ukraine war,-0.1027,negative,2024-11-08,4,11,8,True,moderate,weak
"Iranian military bases, which were not known to world, destroyed in Israel's first",12478,498,2024-10-28 18:31:02,,https://www.india.com/news/world/iranian-military-bases-which-were-not-known-to-world-destroyed-in-israels-first-7356402/amp/,milktanksadmirer,0.92,Israel/Palestine,0,worldnews,Iranian military bases which were not known to world destroyed in Israels first ,iranian military bases known world destroyed israels first,-0.4939,negative,2024-10-28,0,10,18,False,moderate,weak
Zelensky on record drone attack: This is possible only because Russia is circumventing sanctions,12456,141,2024-11-26 15:47:19,,https://www.ukrinform.net/rubric-ato/3931454-zelensky-on-record-drone-attack-this-is-possible-only-because-russia-is-circumventing-sanctions.html,blllrrrrr,0.97,Russia/Ukraine,0,worldnews,Zelensky on record drone attack This is possible only because Russia is circumventing sanctions ,zelensky record drone attack possible russia circumventing sanctions,-0.4767,negative,2024-11-26,1,11,15,False,moderate,weak
Trump Mocked After Mexico's President Blows Up His Brag About Their Call,12444,1138,2024-11-28 16:55:55,,https://www.huffpost.com/entry/trump-mexico-reactions_n_67483821e4b03b6cea3b8621,VonDukez,0.88,,0,worldnews,Trump Mocked After Mexicos President Blows Up His Brag About Their Call ,trump mocked mexicos president blows brag call,-0.3182,negative,2024-11-28,3,11,16,False,moderate,weak
"‘Monstrous’ North Korean artillery spotted in Russia, likely for use in Ukraine ",12421,1124,2024-11-15 16:30:41,,https://www.nknews.org/2024/11/monstrous-north-korean-artillery-spotted-in-russia-likely-for-use-in-ukraine/,blllrrrrr,0.96,Russia/Ukraine,0,worldnews,Monstrous North Korean artillery spotted in Russia likely for use in Ukraine  ,monstrous north korean artillery spotted russia likely use ukraine,0.0,neutral,2024-11-15,4,11,16,False,moderate,weak
Hungary loses entitlement to billions in EU aid,12373,356,2025-01-01 09:27:49,,https://www.bluewin.ch/en/news/international/hungary-loses-entitlement-to-billions-in-eu-aid-2504966.html,BezugssystemCH1903,0.97,,0,worldnews,Hungary loses entitlement to billions in EU aid ,hungary loses entitlement billions aid,-0.3182,negative,2025-01-01,2,1,9,False,moderate,weak
NATO to Hold Emergency Talks After Russia's Hypersonic Missile Attack,12285,965,2024-11-22 16:23:15,,https://www.newsweek.com/nato-emergency-talks-russia-hypersonic-missile-attack-ukraine-1990148,blllrrrrr,0.96,Russia/Ukraine,0,worldnews,NATO to Hold Emergency Talks After Russias Hypersonic Missile Attack ,nato hold emergency talks russias hypersonic missile attack,-0.6908,negative,2024-11-22,4,11,16,False,extreme,strong
"About 8,000 North Korean soldiers at Ukraine border, says US",12258,923,2024-11-01 01:52:29,,https://www.theguardian.com/world/2024/oct/31/north-korean-soldiers-at-ukraine-border-says-us,Gyro_Armadillo,0.97,Russia/Ukraine,0,worldnews,About  North Korean soldiers at Ukraine border says US ,north korean soldiers ukraine border says,0.0,neutral,2024-11-01,4,11,1,False,moderate,weak
Lukashenko says North Korean troops fighting for Putin would be ‘escalation’ of Ukraine war,12237,326,2024-10-24 09:00:38,,https://www.politico.eu/article/alexander-lukashenko-north-korean-troops-escalation-ukraine-war-vladimir-putin/,ubcstaffer123,0.97,Russia/Ukraine,0,worldnews,Lukashenko says North Korean troops fighting for Putin would be escalation of Ukraine war ,lukashenko says north korean troops fighting putin would escalation ukraine war,-0.7506,negative,2024-10-24,3,10,9,True,extreme,strong
"Iran religious group recognizes Israel, causing outrage",12230,366,2024-11-05 14:53:36,,https://www.ynetnews.com/article/b1egvtdwyl#autoplay,Red_Franklin,0.93,Israel/Palestine,0,worldnews,Iran religious group recognizes Israel causing outrage ,iran religious group recognizes israel causing outrage,-0.5106,negative,2024-11-05,1,11,14,False,extreme,strong
Kyiv says Russian troops advancing fast as missile fears grow,12158,1399,2024-11-22 20:00:54,,https://www.courthousenews.com?page_id=1037023,BobbyLucero,0.95,Russia/Ukraine,0,worldnews,Kyiv says Russian troops advancing fast as missile fears grow ,kyiv says russian troops advancing fast missile fears grow,-0.4215,negative,2024-11-22,4,11,20,False,moderate,weak
US to Iran: Avoid strikes or face unrestrained Israeli retaliation - report,12152,941,2024-11-03 00:55:01,,https://www.jpost.com/middle-east/article-827270,Silly-avocatoe,0.92,Israel/Palestine,0,worldnews,US to Iran Avoid strikes or face unrestrained Israeli retaliation  report ,iran avoid strikes face unrestrained israeli retaliation report,-0.5719,negative,2024-11-03,6,11,0,False,extreme,strong
Taiwan wants to buy F-35 fighter jets and Patriot missiles to show Trump it's serious: report,12134,555,2024-11-11 15:24:15,,https://www.businessinsider.com/taiwan-f35-patriot-purchase-signal-defense-readiness-trump-china-weapons-2024-11,DazzJuggernaut,0.96,Behind Soft Paywall,0,worldnews,Taiwan wants to buy F fighter jets and Patriot missiles to show Trump its serious report ,taiwan wants buy fighter jets patriot missiles show trump serious report,0.0772,neutral,2024-11-11,0,11,15,False,moderate,weak
Biden blocks Japan's Nippon Steel from buying US Steel,12019,718,2025-01-03 21:21:01,,https://www.bbc.com/news/articles/cx2vz83pg9eo,doopityWoop22,0.97,,0,worldnews,Biden blocks Japans Nippon Steel from buying US Steel ,biden blocks japans nippon steel buying steel,-0.2263,negative,2025-01-03,4,1,21,False,moderate,weak
"‘We Were Sent As Meat,’ A Russian Soldier Says After His Vehicle Rolled Right In Front Of Two Ukrainian Tanks",12010,392,2024-10-31 15:54:40,,https://www.forbes.com/sites/davidaxe/2024/10/30/we-were-sent-as-meat-a-russian-soldier-says-after-his-vehicle-rolled-right-in-front-of-two-ukrainian-tanks/,eaglemaxie,0.97,Russia/Ukraine,0,worldnews,We Were Sent As Meat A Russian Soldier Says After His Vehicle Rolled Right In Front Of Two Ukrainian Tanks ,sent meat russian soldier says vehicle rolled right front two ukrainian tanks,0.0,neutral,2024-10-31,3,10,15,False,moderate,weak
Russian police reportedly raid Moscow Conservatory dorm and issue military summonses to students,11936,734,2024-11-27 01:18:26,,https://meduza.io/en/news/2024/11/25/russian-police-reportedly-raid-moscow-conservatory-dorm-and-issue-military-summons-to-students,ubcstaffer123,0.96,Russia/Ukraine,0,worldnews,Russian police reportedly raid Moscow Conservatory dorm and issue military summonses to students ,russian police reportedly raid moscow conservatory dorm issue military summonses students,0.0,neutral,2024-11-27,2,11,1,False,moderate,weak
Modi Says BRICS Must Avoid Being an Anti-West Group as It Grows,11888,1223,2024-10-24 09:41:36,,https://www.bloomberg.com/news/articles/2024-10-24/modi-says-brics-must-avoid-being-an-anti-west-group-as-it-grows?srnd=homepage-europe,walrus_operator,0.93,Behind Soft Paywall,0,worldnews,Modi Says BRICS Must Avoid Being an AntiWest Group as It Grows ,modi says brics must avoid antiwest group grows,-0.296,negative,2024-10-24,3,10,9,False,moderate,weak
Trump again calls to buy Greenland after eyeing Canada and the Panama Canal,11831,1575,2024-12-23 20:32:01,,https://apnews.com/article/trump-greenland-norway-panama-canal-canada-a52858e3075f9b5ad95e78753293fc1f,naqi11,0.93,,0,worldnews,Trump again calls to buy Greenland after eyeing Canada and the Panama Canal ,trump calls buy greenland eyeing canada panama canal,0.0,neutral,2024-12-23,0,12,20,False,moderate,weak
"Ukrainian POWs Reportedly Stripped Naked, Shot in Russia’s Kursk Region",11770,360,2024-10-13 11:47:04,,https://www.kyivpost.com/post/40459,Ask4MD,0.94,Russia/Ukraine,0,worldnews,Ukrainian POWs Reportedly Stripped Naked Shot in Russias Kursk Region ,ukrainian pows reportedly stripped naked shot russias kursk region,0.0,neutral,2024-10-13,6,10,11,False,moderate,weak
Zelenskyy rejects visit of UN Secretary General to Kyiv after his trip to Russia – AFP,11761,350,2024-10-25 14:13:13,,https://www.pravda.com.ua/eng/news/2024/10/25/7481372/,Silly-avocatoe,0.97,Russia/Ukraine,0,worldnews,Zelenskyy rejects visit of UN Secretary General to Kyiv after his trip to Russia  AFP ,zelenskyy rejects visit secretary general kyiv trip russia afp,-0.4939,negative,2024-10-25,4,10,14,False,moderate,weak
High ranking Russian military commander assassinated near Moscow,11716,232,2024-10-17 19:42:45,,https://www.newsweek.com/russia-moscow-officer-shot-1970367,CompetitiveNovel8990,0.98,Russia/Ukraine,0,worldnews,High ranking Russian military commander assassinated near Moscow ,high ranking russian military commander assassinated near moscow,0.0,neutral,2024-10-17,3,10,19,False,moderate,weak
"Ukraine destroys 3 more Russian radar systems in Crimea, military intelligence claims",11680,141,2024-11-30 15:20:06,,https://kyivindependent.com/ukraine-destroys-three-more-russian-radar-systems-in-crimea-military-intelligence-claims/,BothZookeepergame612,0.97,Russia/Ukraine,0,worldnews,Ukraine destroys  more Russian radar systems in Crimea military intelligence claims ,ukraine destroys russian radar systems crimea military intelligence claims,-0.128,negative,2024-11-30,5,11,15,False,moderate,weak
‘No one can stop China’s “reunification” with Taiwan’ Xi says,11592,1915,2024-12-31 19:45:56,,https://sarajevotimes.com/no-one-can-stop-chinas-reunification-with-taiwan-xi-says/,guyoffthegrid,0.91,,0,worldnews,No one can stop Chinas reunification with Taiwan Xi says ,one stop chinas reunification taiwan says,-0.296,negative,2024-12-31,1,12,19,False,moderate,weak
"British intelligence reports a major purge of corrupt generals in Moscow
",11571,468,2024-10-21 14:01:51,,https://odessa-journal.com/british-intelligence-reports-a-major-purge-of-corrupt-generals-in-moscow,CompetitiveNovel8990,0.98,Russia/Ukraine,0,worldnews,"British intelligence reports a major purge of corrupt generals in Moscow
 ",british intelligence reports major purge corrupt generals moscow,0.4767,positive,2024-10-21,0,10,14,False,moderate,weak
TikTok CEO summoned to European Parliament over role in shock Romania election,11559,751,2024-11-26 17:40:24,,https://www.politico.eu/article/elections-tiktok-ceo-eu-parliament-romania-election-fake-accounts-pro-russia-calin-georgescu-nato-shock-victory/,MiniBrownie,0.96,,0,worldnews,TikTok CEO summoned to European Parliament over role in shock Romania election ,tiktok ceo summoned european parliament role shock romania election,-0.3818,negative,2024-11-26,1,11,17,True,moderate,weak
